Halt Date,Halt Time,Symbol,Name,Exchange,Reason,Resume Date,NYSE Resume Time
12/13/2024,17:26:59,CKPT,"Checkpoint Therapeutics, Inc. Common Stock",Nasdaq,News pending,2024-12-13,18:45:00
12/13/2024,16:29:37,WEL U,"Integrated Wellness Acquisition Corp Units, each consisting of one Class A ordinary share and one-half of one redeemable warrant",NYSE,News Released,,
12/13/2024,16:29:37,WEL WS,Integrated Wellness Acquisition Corp Redeemable Warrants,NYSE,News Released,,
12/13/2024,16:29:37,WEL,Integrated Wellness Acquisition Corp,NYSE,News Released,,
12/13/2024,16:18:45,AUMN,Golden Minerals Company,NYSE American,News Released,,
12/13/2024,16:05:14,WEL U,"Integrated Wellness Acquisition Corp Units, each consisting of one Class A ordinary share and one-half of one redeemable warrant",NYSE,News pending,See Subsequent Halt,See Subsequent Halt
12/13/2024,16:05:14,WEL WS,Integrated Wellness Acquisition Corp Redeemable Warrants,NYSE,News pending,See Subsequent Halt,See Subsequent Halt
12/13/2024,16:05:14,WEL,Integrated Wellness Acquisition Corp,NYSE,News pending,See Subsequent Halt,See Subsequent Halt
12/13/2024,15:31:46,AUMN,Golden Minerals Company,NYSE American,News pending,See Subsequent Halt,See Subsequent Halt
12/13/2024,14:58:09,INAQU,Insight Acquisition Corp. Units,Nasdaq,LULD pause,2024-12-13,15:03:09
12/13/2024,14:54:05,MHH,"Mastech Digital, Inc.",NYSE American,News pending,,
12/13/2024,14:50:09,INAQU,Insight Acquisition Corp. Units,Nasdaq,LULD pause,2024-12-13,14:55:09
12/13/2024,14:48:38,INAQ,Insight Acquisition Corp. Class A Common Stock,Nasdaq,LULD pause,2024-12-13,14:53:38
12/13/2024,14:34:23,CYCCP,"Cyclacel Pharmaceuticals, Inc. 6% Cnvrtbl. Prfrd. Stock",Nasdaq,LULD pause,2024-12-13,14:39:23
12/13/2024,14:10:39,WKEY,WISeKey International Holding AG American Depositary Shares,Nasdaq,LULD pause,2024-12-13,14:15:39
12/13/2024,14:00:39,WKEY,WISeKey International Holding AG American Depositary Shares,Nasdaq,LULD pause,2024-12-13,14:05:39
12/13/2024,13:18:38,LVRO,Lavoro Limited Class A Ordinary Shares,Nasdaq,LULD pause,2024-12-13,13:28:39
12/13/2024,11:55:40,WKEY,WISeKey International Holding AG American Depositary Shares,Nasdaq,LULD pause,2024-12-13,12:00:40
12/13/2024,11:40:53,WKEY,WISeKey International Holding AG American Depositary Shares,Nasdaq,LULD pause,2024-12-13,11:45:53
12/13/2024,11:34:27,EVOK,"Evoke Pharma, Inc.",Nasdaq,LULD pause,2024-12-13,11:39:27
12/13/2024,11:30:21,NL,"NL Industries, Inc.",NYSE,LULD pause,2024-12-13,11:35:35
12/13/2024,11:01:20,DBGI,"Digital Brands Group, Inc. Common Stock",Nasdaq,LULD pause,2024-12-13,11:06:20
12/13/2024,10:55:38,DBGI,"Digital Brands Group, Inc. Common Stock",Nasdaq,LULD pause,2024-12-13,11:00:38
12/13/2024,10:45:01,WKEY,WISeKey International Holding AG American Depositary Shares,Nasdaq,LULD pause,2024-12-13,10:50:01
12/13/2024,10:43:51,SNES,"SenesTech, Inc. Common Stock",Nasdaq,LULD pause,2024-12-13,10:48:51
12/13/2024,10:18:56,WKEY,WISeKey International Holding AG American Depositary Shares,Nasdaq,LULD pause,2024-12-13,10:23:56
12/13/2024,10:13:25,WKEY,WISeKey International Holding AG American Depositary Shares,Nasdaq,LULD pause,2024-12-13,10:18:25
12/13/2024,10:12:46,GTI,Graphjet Technology Class A Ordinary Shares,Nasdaq,LULD pause,2024-12-13,10:17:46
12/13/2024,10:10:02,GELS,Gelteq Limited Ordinary Shares,Nasdaq,LULD pause,2024-12-13,10:20:02
12/13/2024,10:08:23,INHD,Inno Holdings Inc. Common Stock,Nasdaq,LULD pause,2024-12-13,10:13:23
12/13/2024,10:07:41,WKEY,WISeKey International Holding AG American Depositary Shares,Nasdaq,LULD pause,2024-12-13,10:12:41
12/13/2024,10:01:36,ATIF,ATIF Holdings Limited Ordinary Shares,Nasdaq,LULD pause,2024-12-13,10:06:36
12/13/2024,10:01:05,INHD,Inno Holdings Inc. Common Stock,Nasdaq,LULD pause,2024-12-13,10:06:05
12/13/2024,09:56:57,WKEY,WISeKey International Holding AG American Depositary Shares,Nasdaq,LULD pause,2024-12-13,10:06:57
12/13/2024,09:55:41,IVCP,Swiftmerge Acquisition Corp. Class A Ordinary Share,Nasdaq,LULD pause,2024-12-13,10:00:41
12/13/2024,09:51:59,EFSH,1847 Holdings LLC,NYSE American,News pending,2024-12-13,10:20:00
12/13/2024,09:46:14,ATIF,ATIF Holdings Limited Ordinary Shares,Nasdaq,LULD pause,2024-12-13,09:51:14
12/13/2024,09:38:24,RPTX,Repare Therapeutics Inc. Common Shares,Nasdaq,LULD pause,2024-12-13,09:43:24
12/13/2024,09:38:11,SDST,Stardust Power Inc. Common Stock,Nasdaq,LULD pause,2024-12-13,09:43:11
12/13/2024,09:35:51,WKEY,WISeKey International Holding AG American Depositary Shares,Nasdaq,LULD pause,2024-12-13,09:56:37
12/13/2024,09:30:58,IVCPU,Swiftmerge Acquisition Corp. Unit,Nasdaq,LULD pause,2024-12-13,09:46:21
12/13/2024,08:45:44,PGRU,PropertyGuru Group Limited,NYSE,Merger Effective,,
12/12/2024,19:50:00,DBGIW,"Digital Brands Group, Inc. Warrant",Nasdaq,News pending,2024-12-13,09:05:00
12/12/2024,19:50:00,DBGIW,"Digital Brands Group, Inc. Warrant",Nasdaq,News pending,,
12/12/2024,19:50:00,BLUE,"bluebird bio, Inc. Common Stock",Nasdaq,News pending,2024-12-13,09:00:00
12/12/2024,19:50:00,BLUE,"bluebird bio, Inc. Common Stock",Nasdaq,News pending,,
12/12/2024,19:50:00,DBGI,"Digital Brands Group, Inc. Common Stock",Nasdaq,News pending,2024-12-13,09:00:00
12/12/2024,19:50:00,DBGI,"Digital Brands Group, Inc. Common Stock",Nasdaq,News pending,,
12/12/2024,19:50:00,MNTSW,Momentus Inc. Warrant,Nasdaq,News pending,2024-12-13,09:05:00
12/12/2024,19:50:00,MNTSW,Momentus Inc. Warrant,Nasdaq,News pending,,
12/12/2024,19:50:00,MNTS,Momentus Inc. Class A Common Stock,Nasdaq,News pending,2024-12-13,09:00:00
12/12/2024,19:50:00,MNTS,Momentus Inc. Class A Common Stock,Nasdaq,News pending,,
12/12/2024,19:50:00,MLGO,"MicroAlgo, Inc. Ordinary Shares",Nasdaq,News pending,2024-12-13,09:00:00
12/12/2024,19:50:00,MLGO,"MicroAlgo, Inc. Ordinary Shares",Nasdaq,News pending,,
12/12/2024,16:53:32,TBC,AT&T Inc. 5.625% Global Notes due 2067,NYSE,News Released,,
12/12/2024,15:53:14,CYCCP,"Cyclacel Pharmaceuticals, Inc. 6% Cnvrtbl. Prfrd. Stock",Nasdaq,LULD pause,2024-12-12,16:02:26
12/12/2024,15:48:14,BJDX,"Bluejay Diagnostics, Inc. Common Stock",Nasdaq,LULD pause,2024-12-12,16:00:00
12/12/2024,14:34:51,KOS,Kosmos Energy Ltd.,NYSE,News pending,2024-12-12,15:21:41
12/12/2024,13:55:08,LNKS,Linkers Industries Limited Class A Ordinary Shares,Nasdaq,LULD pause,2024-12-12,14:00:08
12/12/2024,13:36:11,INAQU,Insight Acquisition Corp. Units,Nasdaq,LULD pause,2024-12-12,13:41:11
12/12/2024,13:16:44,APVO,Aptevo Therapeutics Inc,Nasdaq,LULD pause,2024-12-12,13:21:44
12/12/2024,13:02:38,APVO,Aptevo Therapeutics Inc,Nasdaq,LULD pause,2024-12-12,13:07:38
12/12/2024,12:56:09,APVO,Aptevo Therapeutics Inc,Nasdaq,LULD pause,2024-12-12,13:01:09
12/12/2024,12:51:10,HTLM,HomesToLife Ltd Ordinary Shares,Nasdaq,LULD pause,2024-12-12,12:56:10
12/12/2024,12:46:09,LBGJ,Li Bang International Corporation Inc. Ordinary Shares,Nasdaq,LULD pause,2024-12-12,12:51:09
12/12/2024,12:40:34,OSTX,OS Therapies Incorporated,NYSE American,LULD pause,2024-12-12,12:45:34
12/12/2024,12:40:11,LBGJ,Li Bang International Corporation Inc. Ordinary Shares,Nasdaq,LULD pause,2024-12-12,12:45:11
12/12/2024,12:34:49,LBGJ,Li Bang International Corporation Inc. Ordinary Shares,Nasdaq,LULD pause,2024-12-12,12:39:49
12/12/2024,12:26:59,OSTX,OS Therapies Incorporated,NYSE American,LULD pause,2024-12-12,12:36:59
12/12/2024,12:17:29,OSTX,OS Therapies Incorporated,NYSE American,LULD pause,2024-12-12,12:22:29
12/12/2024,12:06:50,OSTX,OS Therapies Incorporated,NYSE American,LULD pause,2024-12-12,12:16:50
12/12/2024,12:05:31,PALI,"Palisade Bio, Inc. Common Stock",Nasdaq,LULD pause,2024-12-12,12:10:31
12/12/2024,11:59:16,JUNS,"Jupiter Neurosciences, Inc. Common Stock",Nasdaq,LULD pause,2024-12-12,12:04:16
12/12/2024,11:51:40,HTLM,HomesToLife Ltd Ordinary Shares,Nasdaq,LULD pause,2024-12-12,11:56:40
12/12/2024,11:47:03,TBC,AT&T Inc. 5.625% Global Notes due 2067,NYSE,News pending,See Subsequent Halt,See Subsequent Halt
12/12/2024,11:01:27,WOK,WORK Medical Technology Group LTD Ordinary Shares,Nasdaq,LULD pause,2024-12-12,11:06:27
12/12/2024,10:51:55,WOK,WORK Medical Technology Group LTD Ordinary Shares,Nasdaq,LULD pause,2024-12-12,10:56:55
12/12/2024,10:51:30,KGS,"Kodiak Gas Services, Inc.",NYSE,News pending,2024-12-12,11:15:04
12/12/2024,10:39:50,WOK,WORK Medical Technology Group LTD Ordinary Shares,Nasdaq,LULD pause,2024-12-12,10:49:50
12/12/2024,10:34:00,TNMG,TNL Mediagene Ordinary Shares,Nasdaq,LULD pause,2024-12-12,10:39:00
12/12/2024,10:21:26,WHLR,"Wheeler Real Estate Investment Trust, Inc",Nasdaq,LULD pause,2024-12-12,10:26:26
12/12/2024,10:05:30,TNMG,TNL Mediagene Ordinary Shares,Nasdaq,LULD pause,2024-12-12,10:10:30
12/12/2024,10:03:33,PTLE,PTL LTD Ordinary Shares,Nasdaq,LULD pause,2024-12-12,10:13:33
12/12/2024,09:57:57,PTLE,PTL LTD Ordinary Shares,Nasdaq,LULD pause,2024-12-12,10:02:57
12/12/2024,09:52:44,RADX,Radiopharm Theranostics Limited American Depositary Shares,Nasdaq,LULD pause,2024-12-12,09:57:44
12/12/2024,09:52:10,SFHG,Samfine Creation Holdings Group Limited Ordinary Share,Nasdaq,LULD pause,2024-12-12,09:57:10
12/12/2024,09:51:39,OSTX,OS Therapies Incorporated,NYSE American,LULD pause,2024-12-12,09:56:39
12/12/2024,09:47:39,PTLE,PTL LTD Ordinary Shares,Nasdaq,LULD pause,2024-12-12,09:52:39
12/12/2024,09:43:00,SFHG,Samfine Creation Holdings Group Limited Ordinary Share,Nasdaq,LULD pause,2024-12-12,09:48:00
12/12/2024,09:42:11,APVO,Aptevo Therapeutics Inc,Nasdaq,LULD pause,2024-12-12,09:47:11
12/12/2024,09:33:25,SFHG,Samfine Creation Holdings Group Limited Ordinary Share,Nasdaq,LULD pause,2024-12-12,09:38:25
12/12/2024,09:33:02,APVO,Aptevo Therapeutics Inc,Nasdaq,LULD pause,2024-12-12,09:38:02
12/12/2024,09:32:24,RADX,Radiopharm Theranostics Limited American Depositary Shares,Nasdaq,LULD pause,2024-12-12,09:37:24
12/12/2024,09:31:03,INVZ,Innoviz Technologies Ltd. Ordinary shares,Nasdaq,LULD pause,2024-12-12,09:36:03
12/12/2024,09:30:19,OSTX,OS Therapies Incorporated,NYSE American,LULD pause,2024-12-12,09:40:19
12/11/2024,19:50:00,LUMO,"Lumos Pharma, Inc. Common Stock",Nasdaq,News pending,,
12/11/2024,19:50:00,AY,Atlantica Sustainable Infrastructure plc Ordinary Shares,Nasdaq,News pending,,
12/11/2024,15:43:58,SFHG,Samfine Creation Holdings Group Limited Ordinary Share,Nasdaq,LULD pause,2024-12-11,15:48:58
12/11/2024,15:37:55,SFHG,Samfine Creation Holdings Group Limited Ordinary Share,Nasdaq,LULD pause,2024-12-11,15:42:55
12/11/2024,15:08:47,SFHG,Samfine Creation Holdings Group Limited Ordinary Share,Nasdaq,LULD pause,2024-12-11,15:13:47
12/11/2024,15:02:26,SFHG,Samfine Creation Holdings Group Limited Ordinary Share,Nasdaq,LULD pause,2024-12-11,15:07:26
12/11/2024,14:47:14,SFHG,Samfine Creation Holdings Group Limited Ordinary Share,Nasdaq,LULD pause,2024-12-11,14:52:14
12/11/2024,14:37:48,SFHG,Samfine Creation Holdings Group Limited Ordinary Share,Nasdaq,LULD pause,2024-12-11,14:42:48
12/11/2024,14:36:27,NEHC,New Era Helium Inc Common Stock,Nasdaq,LULD pause,2024-12-11,14:41:27
12/11/2024,14:32:08,MARX,Mars Acquisition Corp. Ordinary Shares,Nasdaq,LULD pause,2024-12-11,14:37:08
12/11/2024,14:30:14,SFHG,Samfine Creation Holdings Group Limited Ordinary Share,Nasdaq,LULD pause,2024-12-11,14:35:14
12/11/2024,14:17:52,SFHG,Samfine Creation Holdings Group Limited Ordinary Share,Nasdaq,LULD pause,2024-12-11,14:27:52
12/11/2024,14:07:09,SFHG,Samfine Creation Holdings Group Limited Ordinary Share,Nasdaq,LULD pause,2024-12-11,14:17:09
12/11/2024,14:00:30,AQB,"AquaBounty Technologies, Inc.",Nasdaq,LULD pause,2024-12-11,14:05:30
12/11/2024,13:56:24,SFHG,Samfine Creation Holdings Group Limited Ordinary Share,Nasdaq,LULD pause,2024-12-11,14:06:24
12/11/2024,13:54:07,ATLN,Atlantic International Corp. Common Stock,Nasdaq,LULD pause,2024-12-11,14:04:07
12/11/2024,13:51:06,SFHG,Samfine Creation Holdings Group Limited Ordinary Share,Nasdaq,LULD pause,2024-12-11,13:56:06
12/11/2024,13:42:21,SFHG,Samfine Creation Holdings Group Limited Ordinary Share,Nasdaq,LULD pause,2024-12-11,13:47:21
12/11/2024,13:31:58,SFHG,Samfine Creation Holdings Group Limited Ordinary Share,Nasdaq,LULD pause,2024-12-11,13:36:58
12/11/2024,13:21:29,SFHG,Samfine Creation Holdings Group Limited Ordinary Share,Nasdaq,LULD pause,2024-12-11,13:31:29
12/11/2024,13:15:39,SFHG,Samfine Creation Holdings Group Limited Ordinary Share,Nasdaq,LULD pause,2024-12-11,13:20:39
12/11/2024,13:03:49,SFHG,Samfine Creation Holdings Group Limited Ordinary Share,Nasdaq,LULD pause,2024-12-11,13:13:50
12/11/2024,13:03:19,MBNE,SPDR Nuveen Municipal Bond ESG ETF,Cboe BZX,LULD pause,2024-12-11,13:08:19
12/11/2024,12:52:33,SFHG,Samfine Creation Holdings Group Limited Ordinary Share,Nasdaq,LULD pause,2024-12-11,13:02:33
12/11/2024,12:42:03,SFHG,Samfine Creation Holdings Group Limited Ordinary Share,Nasdaq,LULD pause,2024-12-11,12:52:03
12/11/2024,12:13:05,SFHG,Samfine Creation Holdings Group Limited Ordinary Share,Nasdaq,LULD pause,2024-12-11,12:41:35
12/11/2024,11:52:42,SFHG,Samfine Creation Holdings Group Limited Ordinary Share,Nasdaq,LULD pause,2024-12-11,12:12:42
12/11/2024,11:51:14,CADL,"Candel Therapeutics, Inc. Common Stock",Nasdaq,LULD pause,2024-12-11,11:56:14
12/11/2024,11:30:48,SFHG,Samfine Creation Holdings Group Limited Ordinary Share,Nasdaq,LULD pause,2024-12-11,11:52:24
12/11/2024,11:25:32,SFHG,Samfine Creation Holdings Group Limited Ordinary Share,Nasdaq,LULD pause,2024-12-11,11:30:32
12/11/2024,10:25:05,NEHC,New Era Helium Inc Common Stock,Nasdaq,LULD pause,2024-12-11,10:35:05
12/11/2024,10:07:40,LNKS,Linkers Industries Limited Class A Ordinary Shares,Nasdaq,LULD pause,2024-12-11,10:12:40
12/11/2024,10:06:06,QMCO,Quantum Corporation,Nasdaq,LULD pause,2024-12-11,10:11:06
12/11/2024,10:01:27,LNKS,Linkers Industries Limited Class A Ordinary Shares,Nasdaq,LULD pause,2024-12-11,10:06:27
12/11/2024,09:56:04,LNKS,Linkers Industries Limited Class A Ordinary Shares,Nasdaq,LULD pause,2024-12-11,10:01:04
12/11/2024,09:51:43,GELS,Gelteq Limited Ordinary Shares,Nasdaq,LULD pause,2024-12-11,09:56:43
12/11/2024,09:50:21,LDTC,LeddarTech Holdings Inc. Common Shares,Nasdaq,LULD pause,2024-12-11,09:55:21
12/11/2024,09:47:17,NIXX,"Nixxy, Inc. Common Stock",Nasdaq,LULD pause,2024-12-11,09:52:17
12/11/2024,09:47:00,CADL,"Candel Therapeutics, Inc. Common Stock",Nasdaq,LULD pause,2024-12-11,09:52:00
12/11/2024,09:43:56,GELS,Gelteq Limited Ordinary Shares,Nasdaq,LULD pause,2024-12-11,09:48:56
12/11/2024,09:43:12,LNKS,Linkers Industries Limited Class A Ordinary Shares,Nasdaq,LULD pause,2024-12-11,09:53:12
12/11/2024,09:42:22,LAES,SEALSQ Corp Ordinary Shares,Nasdaq,LULD pause,2024-12-11,09:47:22
12/11/2024,09:35:47,NEHC,New Era Helium Inc Common Stock,Nasdaq,LULD pause,2024-12-11,09:45:47
12/11/2024,09:35:42,LDTC,LeddarTech Holdings Inc. Common Shares,Nasdaq,LULD pause,2024-12-11,09:40:42
12/11/2024,09:32:24,CADL,"Candel Therapeutics, Inc. Common Stock",Nasdaq,LULD pause,2024-12-11,09:37:24
12/11/2024,09:30:28,RITR,Reitar Logtech Holdings Limited Ordinary shares,Nasdaq,LULD pause,2024-12-11,09:35:28
12/11/2024,09:30:25,NIXX,"Nixxy, Inc. Common Stock",Nasdaq,LULD pause,2024-12-11,09:46:54
12/11/2024,08:25:00,ANAB,"AnaptysBio, Inc. Common Stock",Nasdaq,News pending,2024-12-11,09:00:00
12/11/2024,06:55:00,PDCO,"Patterson Companies, Inc.",Nasdaq,News pending,2024-12-11,07:30:00
12/10/2024,16:55:00,CLRB,Cellectar Biosciences INC NEW,Nasdaq,News pending,2024-12-10,17:30:00
12/10/2024,16:32:59,ATEK U,"Athena Technology Acquisition Corp. II Units, each consisting of one share of Class A common stock, and one-half of one Redeemable Warrant",NYSE American,News Released,,
12/10/2024,16:32:59,ATEK,Athena Technology Acquisition Corp. II,NYSE American,News Released,,
12/10/2024,16:32:59,ATEK WS,Athena Technology Acquisition Corp. II Redeemable Warrants,NYSE American,News Released,,
12/10/2024,16:25:00,SLRN,"ACELYRIN, INC. Common Stock",Nasdaq,News pending,2024-12-10,17:00:00
12/10/2024,16:05:06,ATEK WS,Athena Technology Acquisition Corp. II Redeemable Warrants,NYSE American,News pending,See Subsequent Halt,See Subsequent Halt
12/10/2024,16:05:06,ATEK U,"Athena Technology Acquisition Corp. II Units, each consisting of one share of Class A common stock, and one-half of one Redeemable Warrant",NYSE American,News pending,See Subsequent Halt,See Subsequent Halt
12/10/2024,16:05:06,ATEK,Athena Technology Acquisition Corp. II,NYSE American,News pending,See Subsequent Halt,See Subsequent Halt
12/10/2024,16:00:15,SPRB,"Spruce Biosciences, Inc. Common Stock",Nasdaq,News pending,2024-12-10,16:30:00
12/10/2024,15:54:41,GXAI,Gaxos.ai Inc. Common Stock,Nasdaq,LULD pause,2024-12-10,16:00:00
12/10/2024,15:34:38,X,United States Steel Corporation,NYSE,LULD pause,2024-12-10,15:39:42
12/10/2024,15:29:07,X,United States Steel Corporation,NYSE,LULD pause,2024-12-10,15:34:21
12/10/2024,15:27:59,ACI,"Albertsons Companies, Inc.",NYSE,LULD pause,2024-12-10,15:33:06
12/10/2024,15:23:04,IVCPU,Swiftmerge Acquisition Corp. Unit,Nasdaq,LULD pause,2024-12-10,15:33:04
12/10/2024,15:22:21,ACI,"Albertsons Companies, Inc.",NYSE,LULD pause,2024-12-10,15:27:35
12/10/2024,13:31:48,APLM,Apollomics Inc. Class A Ordinary Shares,Nasdaq,LULD pause,2024-12-10,13:36:48
12/10/2024,12:31:33,WBA,"Walgreens Boots Alliance, Inc",Nasdaq,LULD pause,2024-12-10,12:41:34
12/10/2024,12:02:48,FBYD,"Falcon's Beyond Global, Inc. Class A Common Stock",Nasdaq,LULD pause,2024-12-10,12:07:48
12/10/2024,11:02:14,GRNQ,Greenpro Capital Corp. Common Stock,Nasdaq,LULD pause,2024-12-10,11:07:14
12/10/2024,10:52:10,GXAI,Gaxos.ai Inc. Common Stock,Nasdaq,LULD pause,2024-12-10,10:57:10
12/10/2024,10:48:13,JUNS,"Jupiter Neurosciences, Inc. Common Stock",Nasdaq,LULD pause,2024-12-10,10:53:13
12/10/2024,10:37:21,JUNS,"Jupiter Neurosciences, Inc. Common Stock",Nasdaq,LULD pause,2024-12-10,10:42:21
12/10/2024,10:36:15,JTAI,Jet.AI Inc. Common Stock,Nasdaq,LULD pause,2024-12-10,10:41:15
12/10/2024,10:26:35,JUNS,"Jupiter Neurosciences, Inc. Common Stock",Nasdaq,LULD pause,2024-12-10,10:36:35
12/10/2024,10:24:59,NEHC,New Era Helium Inc Common Stock,Nasdaq,LULD pause,2024-12-10,10:34:59
12/10/2024,10:21:19,JUNS,"Jupiter Neurosciences, Inc. Common Stock",Nasdaq,LULD pause,2024-12-10,10:26:19
12/10/2024,10:16:03,JUNS,"Jupiter Neurosciences, Inc. Common Stock",Nasdaq,LULD pause,2024-12-10,10:21:03
12/10/2024,10:15:40,NEHC,New Era Helium Inc Common Stock,Nasdaq,LULD pause,2024-12-10,10:20:40
12/10/2024,10:07:52,TNMG,TNL Mediagene Ordinary Shares,Nasdaq,LULD pause,2024-12-10,10:17:52
12/10/2024,10:06:11,NEHC,New Era Helium Inc Common Stock,Nasdaq,LULD pause,2024-12-10,10:11:11
12/10/2024,10:00:45,JUNS,"Jupiter Neurosciences, Inc. Common Stock",Nasdaq,LULD pause,2024-12-10,10:15:45
12/10/2024,09:58:38,TNMG,TNL Mediagene Ordinary Shares,Nasdaq,LULD pause,2024-12-10,10:03:38
12/10/2024,09:56:59,NEHC,New Era Helium Inc Common Stock,Nasdaq,LULD pause,2024-12-10,10:01:59
12/10/2024,09:56:49,GELS,Gelteq Limited Ordinary Shares,Nasdaq,LULD pause,2024-12-10,10:01:49
12/10/2024,09:47:40,NEHC,New Era Helium Inc Common Stock,Nasdaq,LULD pause,2024-12-10,09:52:40
12/10/2024,09:47:29,GELS,Gelteq Limited Ordinary Shares,Nasdaq,LULD pause,2024-12-10,09:52:29
12/10/2024,09:43:33,HWH,HWH International Inc. Common Stock,Nasdaq,LULD pause,2024-12-10,09:48:33
12/10/2024,09:43:10,QURE,uniQure N.V.,Nasdaq,LULD pause,2024-12-10,09:48:10
12/10/2024,09:41:31,GELS,Gelteq Limited Ordinary Shares,Nasdaq,LULD pause,2024-12-10,09:46:31
12/10/2024,09:40:27,MGX,"Metagenomi, Inc. Common Stock",Nasdaq,LULD pause,2024-12-10,09:45:27
12/10/2024,09:35:38,JL,J-Long Group Limited Ordinary Shares,Nasdaq,LULD pause,2024-12-10,09:40:38
12/10/2024,09:35:17,SATL,Satellogic Inc. Class A Ordinary Shares,Nasdaq,LULD pause,2024-12-10,09:40:17
12/10/2024,09:35:14,NEHC,New Era Helium Inc Common Stock,Nasdaq,LULD pause,2024-12-10,09:40:14
12/10/2024,09:34:12,TNMG,TNL Mediagene Ordinary Shares,Nasdaq,LULD pause,2024-12-10,09:39:12
12/10/2024,09:33:47,MSW,Ming Shing Group Holdings Limited Ordinary Shares,Nasdaq,LULD pause,2024-12-10,09:38:47
12/10/2024,09:30:43,MGX,"Metagenomi, Inc. Common Stock",Nasdaq,LULD pause,2024-12-10,09:35:43
12/10/2024,09:30:18,FBYD,"Falcon's Beyond Global, Inc. Class A Common Stock",Nasdaq,LULD pause,2024-12-10,09:40:19
12/10/2024,06:55:00,NAMSW,NewAmsterdam Pharma Company N.V. Warrant,Nasdaq,News pending,2024-12-10,07:35:00
12/10/2024,06:55:00,NAMS,NewAmsterdam Pharma Company N.V. Ordinary Shares,Nasdaq,News pending,2024-12-10,07:30:00
12/10/2024,06:55:00,CRVO,CervoMed Inc. Common Stock,Nasdaq,News pending,2024-12-10,07:30:00
12/09/2024,19:50:00,JL,J-Long Group Limited Ordinary Shares,Nasdaq,News pending,2024-12-10,09:00:00
12/09/2024,19:50:00,JL,J-Long Group Limited Ordinary Shares,Nasdaq,News pending,,
12/09/2024,16:45:25,TCS,"THE CONTAINER STORE GROUP, INC.",NYSE,News Released,,
12/09/2024,16:08:10,TCS,"THE CONTAINER STORE GROUP, INC.",NYSE,News pending,See Subsequent Halt,See Subsequent Halt
12/09/2024,15:27:09,TNMG,TNL Mediagene Ordinary Shares,Nasdaq,LULD pause,2024-12-09,15:32:09
12/09/2024,15:12:29,TNMG,TNL Mediagene Ordinary Shares,Nasdaq,LULD pause,2024-12-09,15:22:29
12/09/2024,15:03:45,CHSN,Chanson International Holding Class A Ordinary Shares,Nasdaq,LULD pause,2024-12-09,16:00:00
12/09/2024,14:57:49,TLYS,Tilly's Inc.,NYSE,LULD pause,2024-12-09,15:02:52
12/09/2024,14:35:00,LDTC,LeddarTech Holdings Inc. Common Shares,Nasdaq,LULD pause,2024-12-09,14:40:00
12/09/2024,14:29:21,LDTC,LeddarTech Holdings Inc. Common Shares,Nasdaq,LULD pause,2024-12-09,14:34:21
12/09/2024,14:12:11,LDTC,LeddarTech Holdings Inc. Common Shares,Nasdaq,LULD pause,2024-12-09,14:17:11
12/09/2024,13:56:39,HUIZ,Huize Holding Limited American Depositary Shares,Nasdaq,LULD pause,2024-12-09,14:01:39
12/09/2024,13:20:55,HUIZ,Huize Holding Limited American Depositary Shares,Nasdaq,LULD pause,2024-12-09,13:25:55
12/09/2024,13:12:26,CCM,Concord Medical Services Holding Limited,NYSE,LULD pause,2024-12-09,13:17:35
12/09/2024,13:05:27,HUIZ,Huize Holding Limited American Depositary Shares,Nasdaq,LULD pause,2024-12-09,13:15:28
12/09/2024,12:59:47,HUIZ,Huize Holding Limited American Depositary Shares,Nasdaq,LULD pause,2024-12-09,13:04:47
12/09/2024,12:30:24,DUO,Fangdd Network Group Ltd. Class A Ordinary Shares,Nasdaq,LULD pause,2024-12-09,12:35:24
12/09/2024,12:22:51,NEHC,New Era Helium Inc Common Stock,Nasdaq,LULD pause,2024-12-09,12:27:51
12/09/2024,12:09:07,NEHC,New Era Helium Inc Common Stock,Nasdaq,LULD pause,2024-12-09,12:19:08
12/09/2024,12:06:10,LDTC,LeddarTech Holdings Inc. Common Shares,Nasdaq,LULD pause,2024-12-09,12:11:10
12/09/2024,12:00:16,LDTC,LeddarTech Holdings Inc. Common Shares,Nasdaq,LULD pause,2024-12-09,12:05:16
12/09/2024,11:44:41,TNMG,TNL Mediagene Ordinary Shares,Nasdaq,LULD pause,2024-12-09,11:54:41
12/09/2024,11:40:26,JYD,Jayud Global Logistics Limited Class A Ordinary Shares,Nasdaq,LULD pause,2024-12-09,11:45:26
12/09/2024,11:00:05,TNMG,TNL Mediagene Ordinary Shares,Nasdaq,LULD pause,2024-12-09,11:10:05
12/09/2024,10:53:26,ASST,Asset Entities Inc. Class B Common Stock,Nasdaq,LULD pause,2024-12-09,10:58:26
12/09/2024,10:36:52,TNMG,TNL Mediagene Ordinary Shares,Nasdaq,LULD pause,2024-12-09,10:46:52
12/09/2024,10:36:28,RVPH,"Reviva Pharmaceuticals Holdings, Inc. Common Stock",Nasdaq,LULD pause,2024-12-09,10:46:29
12/09/2024,10:24:16,TNMG,TNL Mediagene Ordinary Shares,Nasdaq,LULD pause,2024-12-09,10:34:16
12/09/2024,10:18:40,TNMG,TNL Mediagene Ordinary Shares,Nasdaq,LULD pause,2024-12-09,10:23:40
12/09/2024,10:12:38,TNMG,TNL Mediagene Ordinary Shares,Nasdaq,LULD pause,2024-12-09,10:17:38
12/09/2024,10:11:48,RADX,Radiopharm Theranostics Limited American Depositary Shares,Nasdaq,LULD pause,2024-12-09,10:21:48
12/09/2024,10:07:01,LDTC,LeddarTech Holdings Inc. Common Shares,Nasdaq,LULD pause,2024-12-09,10:12:01
12/09/2024,10:05:02,HSY,The Hershey Company,NYSE,LULD pause,2024-12-09,10:10:33
12/09/2024,10:03:44,DUO,Fangdd Network Group Ltd. Class A Ordinary Shares,Nasdaq,LULD pause,2024-12-09,10:08:44
12/09/2024,10:00:39,RADX,Radiopharm Theranostics Limited American Depositary Shares,Nasdaq,LULD pause,2024-12-09,10:10:40
12/09/2024,09:54:48,TNMG,TNL Mediagene Ordinary Shares,Nasdaq,LULD pause,2024-12-09,09:59:48
12/09/2024,09:53:59,ZSPC,"zSpace, Inc. Common stock",Nasdaq,LULD pause,2024-12-09,10:03:59
12/09/2024,09:53:43,LDTC,LeddarTech Holdings Inc. Common Shares,Nasdaq,LULD pause,2024-12-09,09:58:43
12/09/2024,09:48:11,ZSPC,"zSpace, Inc. Common stock",Nasdaq,LULD pause,2024-12-09,09:53:11
12/09/2024,09:48:02,LDTC,LeddarTech Holdings Inc. Common Shares,Nasdaq,LULD pause,2024-12-09,09:53:02
12/09/2024,09:46:26,DUO,Fangdd Network Group Ltd. Class A Ordinary Shares,Nasdaq,LULD pause,2024-12-09,09:51:26
12/09/2024,09:42:19,DXYZ,Destiny Tech100 Inc.,NYSE,LULD pause,2024-12-09,09:47:21
12/09/2024,09:40:33,RADX,Radiopharm Theranostics Limited American Depositary Shares,Nasdaq,LULD pause,2024-12-09,09:54:17
12/09/2024,09:40:18,DUO,Fangdd Network Group Ltd. Class A Ordinary Shares,Nasdaq,LULD pause,2024-12-09,09:45:18
12/09/2024,09:36:31,TNMG,TNL Mediagene Ordinary Shares,Nasdaq,LULD pause,2024-12-09,09:46:31
12/09/2024,09:34:41,LDTC,LeddarTech Holdings Inc. Common Shares,Nasdaq,LULD pause,2024-12-09,09:39:41
12/09/2024,09:33:34,DXYZ,Destiny Tech100 Inc.,NYSE,LULD pause,2024-12-09,09:38:40
12/09/2024,09:31:48,IPXXU,Inflection Point Acquisition Corp. II Unit,Nasdaq,LULD pause,2024-12-09,09:36:48
12/09/2024,09:31:20,RADX,Radiopharm Theranostics Limited American Depositary Shares,Nasdaq,LULD pause,2024-12-09,09:36:20
12/09/2024,09:30:29,RVPH,"Reviva Pharmaceuticals Holdings, Inc. Common Stock",Nasdaq,LULD pause,2024-12-09,10:36:10
12/09/2024,09:30:27,RENT,"Rent the Runway, Inc. Class A Common Stock",Nasdaq,LULD pause,2024-12-09,09:40:27
12/09/2024,07:55:00,PTVE,Pactiv Evergreen Inc. Common stock,Nasdaq,News pending,2024-12-09,08:30:00
12/09/2024,07:25:00,EBTC,Enterprise Bancorp Inc.,Nasdaq,News pending,2024-12-09,08:00:00
12/09/2024,07:25:00,RLMD,"Relmada Therapeutics, Inc. Common Stock",Nasdaq,News pending,2024-12-09,08:00:00
12/09/2024,04:00:00,NEHC,New Era Helium Inc Common Stock,Nasdaq,News pending,2024-12-09,12:06:00
12/09/2024,04:00:00,NEHCW,New Era Helium Inc Warrants,Nasdaq,News pending,2024-12-09,12:05:00
12/06/2024,19:50:00,HUIZ,Huize Holding Limited American Depositary Shares,Nasdaq,News pending,2024-12-09,09:00:00
12/06/2024,19:50:00,HUIZ,Huize Holding Limited American Depositary Shares,Nasdaq,News pending,,
12/06/2024,16:00:10,BIOA,"BioAge Labs, Inc. Common Stock",Nasdaq,News pending,2024-12-06,17:00:00
12/06/2024,15:02:39,RADX,Radiopharm Theranostics Limited American Depositary Shares,Nasdaq,LULD pause,2024-12-06,15:07:39
12/06/2024,14:51:15,RADX,Radiopharm Theranostics Limited American Depositary Shares,Nasdaq,LULD pause,2024-12-06,15:01:15
12/06/2024,14:26:25,TNMG,TNL Mediagene Ordinary Shares,Nasdaq,LULD pause,2024-12-06,14:31:25
12/06/2024,14:15:52,TNMG,TNL Mediagene Ordinary Shares,Nasdaq,LULD pause,2024-12-06,14:25:52
12/06/2024,13:49:01,LICN,Lichen China Limited Class A Ordinary Shares,Nasdaq,LULD pause,2024-12-06,13:54:01
12/06/2024,13:43:58,TNMG,TNL Mediagene Ordinary Shares,Nasdaq,LULD pause,2024-12-06,14:14:40
12/06/2024,13:31:45,TNMG,TNL Mediagene Ordinary Shares,Nasdaq,LULD pause,2024-12-06,13:41:45
12/06/2024,13:27:31,LICN,Lichen China Limited Class A Ordinary Shares,Nasdaq,LULD pause,2024-12-06,13:32:31
12/06/2024,13:25:54,TNMG,TNL Mediagene Ordinary Shares,Nasdaq,LULD pause,2024-12-06,13:30:54
12/06/2024,13:21:56,LICN,Lichen China Limited Class A Ordinary Shares,Nasdaq,LULD pause,2024-12-06,13:26:56
12/06/2024,13:11:10,LICN,Lichen China Limited Class A Ordinary Shares,Nasdaq,LULD pause,2024-12-06,13:16:10
12/06/2024,12:53:45,SBET,SharpLink Gaming Ltd. Ordinary Shares,Nasdaq,LULD pause,2024-12-06,12:58:45
12/06/2024,12:45:28,LICN,Lichen China Limited Class A Ordinary Shares,Nasdaq,LULD pause,2024-12-06,12:50:28
12/06/2024,12:43:01,RADX,Radiopharm Theranostics Limited American Depositary Shares,Nasdaq,LULD pause,2024-12-06,12:48:01
12/06/2024,12:39:53,LICN,Lichen China Limited Class A Ordinary Shares,Nasdaq,LULD pause,2024-12-06,12:44:53
12/06/2024,12:35:29,NAMI,Jinxin Technology Holding Company American Depositary Shares,Nasdaq,LULD pause,2024-12-06,12:40:29
12/06/2024,12:27:11,TNMG,TNL Mediagene Ordinary Shares,Nasdaq,LULD pause,2024-12-06,12:32:11
12/06/2024,12:23:36,NAMI,Jinxin Technology Holding Company American Depositary Shares,Nasdaq,LULD pause,2024-12-06,12:33:36
12/06/2024,12:14:05,RADX,Radiopharm Theranostics Limited American Depositary Shares,Nasdaq,LULD pause,2024-12-06,12:24:06
12/06/2024,12:13:20,NAMI,Jinxin Technology Holding Company American Depositary Shares,Nasdaq,LULD pause,2024-12-06,12:23:20
12/06/2024,12:07:54,JYD,Jayud Global Logistics Limited Class A Ordinary Shares,Nasdaq,LULD pause,2024-12-06,12:17:54
12/06/2024,12:07:14,NAMI,Jinxin Technology Holding Company American Depositary Shares,Nasdaq,LULD pause,2024-12-06,12:12:14
12/06/2024,11:56:55,NAMI,Jinxin Technology Holding Company American Depositary Shares,Nasdaq,LULD pause,2024-12-06,12:06:55
12/06/2024,11:55:54,TNMG,TNL Mediagene Ordinary Shares,Nasdaq,LULD pause,2024-12-06,12:25:55
12/06/2024,11:51:39,NAMI,Jinxin Technology Holding Company American Depositary Shares,Nasdaq,LULD pause,2024-12-06,11:56:39
12/06/2024,11:50:17,TNMG,TNL Mediagene Ordinary Shares,Nasdaq,LULD pause,2024-12-06,11:55:17
12/06/2024,11:48:16,RADX,Radiopharm Theranostics Limited American Depositary Shares,Nasdaq,LULD pause,2024-12-06,11:58:16
12/06/2024,11:46:06,NAMI,Jinxin Technology Holding Company American Depositary Shares,Nasdaq,LULD pause,2024-12-06,11:51:06
12/06/2024,11:37:49,RADX,Radiopharm Theranostics Limited American Depositary Shares,Nasdaq,LULD pause,2024-12-06,11:42:49
12/06/2024,11:37:35,ORIS,Oriental Rise Holdings Limited Ordinary Shares,Nasdaq,LULD pause,2024-12-06,11:47:35
12/06/2024,11:37:07,TNMG,TNL Mediagene Ordinary Shares,Nasdaq,LULD pause,2024-12-06,11:49:36
12/06/2024,11:35:33,NAMI,Jinxin Technology Holding Company American Depositary Shares,Nasdaq,LULD pause,2024-12-06,11:45:48
12/06/2024,11:32:06,RADX,Radiopharm Theranostics Limited American Depositary Shares,Nasdaq,LULD pause,2024-12-06,11:37:06
12/06/2024,11:31:26,TNMG,TNL Mediagene Ordinary Shares,Nasdaq,LULD pause,2024-12-06,11:36:26
12/06/2024,11:22:02,ZJK,"ZJK Industrial Co., Ltd. Ordinary Shares",Nasdaq,LULD pause,2024-12-06,11:27:02
12/06/2024,11:20:49,TNMG,TNL Mediagene Ordinary Shares,Nasdaq,LULD pause,2024-12-06,11:30:59
12/06/2024,11:16:13,ORIS,Oriental Rise Holdings Limited Ordinary Shares,Nasdaq,LULD pause,2024-12-06,11:21:13
12/06/2024,11:11:10,RADX,Radiopharm Theranostics Limited American Depositary Shares,Nasdaq,LULD pause,2024-12-06,11:26:11
12/06/2024,11:07:47,ORIS,Oriental Rise Holdings Limited Ordinary Shares,Nasdaq,LULD pause,2024-12-06,11:12:47
12/06/2024,11:05:17,RADX,Radiopharm Theranostics Limited American Depositary Shares,Nasdaq,LULD pause,2024-12-06,11:10:17
12/06/2024,10:55:33,ORIS,Oriental Rise Holdings Limited Ordinary Shares,Nasdaq,LULD pause,2024-12-06,11:05:33
12/06/2024,10:53:58,LICN,Lichen China Limited Class A Ordinary Shares,Nasdaq,LULD pause,2024-12-06,10:58:58
12/06/2024,10:52:12,ZJK,"ZJK Industrial Co., Ltd. Ordinary Shares",Nasdaq,LULD pause,2024-12-06,10:57:12
12/06/2024,10:40:54,ORIS,Oriental Rise Holdings Limited Ordinary Shares,Nasdaq,LULD pause,2024-12-06,10:45:54
12/06/2024,10:40:34,TNMG,TNL Mediagene Ordinary Shares,Nasdaq,LULD pause,2024-12-06,11:20:34
12/06/2024,10:38:32,LICN,Lichen China Limited Class A Ordinary Shares,Nasdaq,LULD pause,2024-12-06,10:48:32
12/06/2024,10:33:06,LICN,Lichen China Limited Class A Ordinary Shares,Nasdaq,LULD pause,2024-12-06,10:38:06
12/06/2024,10:27:28,LICN,Lichen China Limited Class A Ordinary Shares,Nasdaq,LULD pause,2024-12-06,10:32:28
12/06/2024,10:24:34,RADX,Radiopharm Theranostics Limited American Depositary Shares,Nasdaq,LULD pause,2024-12-06,11:04:34
12/06/2024,10:21:56,ORIS,Oriental Rise Holdings Limited Ordinary Shares,Nasdaq,LULD pause,2024-12-06,10:26:56
12/06/2024,10:17:46,FOXX,Foxx Development Holdings Inc. Common Stock,Nasdaq,LULD pause,2024-12-06,10:22:46
12/06/2024,10:17:18,TNMG,TNL Mediagene Ordinary Shares,Nasdaq,LULD pause,2024-12-06,10:40:06
12/06/2024,10:16:54,LICN,Lichen China Limited Class A Ordinary Shares,Nasdaq,LULD pause,2024-12-06,10:26:54
12/06/2024,10:16:23,ORIS,Oriental Rise Holdings Limited Ordinary Shares,Nasdaq,LULD pause,2024-12-06,10:21:23
12/06/2024,10:13:49,RADX,Radiopharm Theranostics Limited American Depositary Shares,Nasdaq,LULD pause,2024-12-06,10:23:50
12/06/2024,10:08:05,RADX,Radiopharm Theranostics Limited American Depositary Shares,Nasdaq,LULD pause,2024-12-06,10:13:05
12/06/2024,10:03:12,ORIS,Oriental Rise Holdings Limited Ordinary Shares,Nasdaq,LULD pause,2024-12-06,10:08:12
12/06/2024,09:57:41,GXAI,Gaxos.ai Inc. Common Stock,Nasdaq,LULD pause,2024-12-06,10:02:41
12/06/2024,09:56:48,ORIS,Oriental Rise Holdings Limited Ordinary Shares,Nasdaq,LULD pause,2024-12-06,10:01:48
12/06/2024,09:55:18,RADX,Radiopharm Theranostics Limited American Depositary Shares,Nasdaq,LULD pause,2024-12-06,10:07:24
12/06/2024,09:54:19,UPC,Universe Pharmaceuticals Inc. Ordinary Shares,Nasdaq,LULD pause,2024-12-06,09:59:19
12/06/2024,09:46:15,ORIS,Oriental Rise Holdings Limited Ordinary Shares,Nasdaq,LULD pause,2024-12-06,09:56:15
12/06/2024,09:45:50,GTN A,"Gray Television, Inc. Class A",NYSE,LULD pause,2024-12-06,09:50:50
12/06/2024,09:44:53,RADX,Radiopharm Theranostics Limited American Depositary Shares,Nasdaq,LULD pause,2024-12-06,09:54:54
12/06/2024,09:37:37,THCPU,"Thunder Bridge Capital Partners IV, Inc. Unit",Nasdaq,LULD pause,2024-12-06,09:42:37
12/06/2024,09:35:58,ORIS,Oriental Rise Holdings Limited Ordinary Shares,Nasdaq,LULD pause,2024-12-06,09:45:58
12/06/2024,09:33:04,ZSPC,"zSpace, Inc. Common stock",Nasdaq,LULD pause,2024-12-06,09:38:04
12/06/2024,09:30:42,ORIS,Oriental Rise Holdings Limited Ordinary Shares,Nasdaq,LULD pause,2024-12-06,09:35:42
12/06/2024,09:30:36,RADX,Radiopharm Theranostics Limited American Depositary Shares,Nasdaq,LULD pause,2024-12-06,09:44:13
12/06/2024,09:10:08,PROF,Profound Medical Corp. Common Stock,Nasdaq,News pending,2024-12-06,09:50:00
12/06/2024,09:10:07,OGI,Organigram Holdings Inc. Common Shares,Nasdaq,News pending,2024-12-06,09:50:00
12/05/2024,19:50:00,ENSC,"Ensysce Biosciences, Inc. Common Stock",Nasdaq,News pending,2024-12-06,09:00:00
12/05/2024,19:50:00,ENSC,"Ensysce Biosciences, Inc. Common Stock",Nasdaq,News pending,,
12/05/2024,15:31:26,CAMP,CAMP4 Therapeutics Corporation Common Stock,Nasdaq,LULD pause,2024-12-05,15:36:26
12/05/2024,15:27:24,RADX,Radiopharm Theranostics Limited American Depositary Shares,Nasdaq,LULD pause,2024-12-05,16:00:00
12/05/2024,15:16:28,ZSPC,"zSpace, Inc. Common stock",Nasdaq,LULD pause,2024-12-05,15:32:25
12/05/2024,15:06:04,ZSPC,"zSpace, Inc. Common stock",Nasdaq,LULD pause,2024-12-05,15:16:04
12/05/2024,14:55:41,ZSPC,"zSpace, Inc. Common stock",Nasdaq,LULD pause,2024-12-05,15:05:41
12/05/2024,14:50:11,ZSPC,"zSpace, Inc. Common stock",Nasdaq,LULD pause,2024-12-05,14:55:11
12/05/2024,14:44:43,ZSPC,"zSpace, Inc. Common stock",Nasdaq,LULD pause,2024-12-05,14:49:43
12/05/2024,14:34:03,RADX,Radiopharm Theranostics Limited American Depositary Shares,Nasdaq,LULD pause,2024-12-05,15:27:03
12/05/2024,14:30:32,ZSPC,"zSpace, Inc. Common stock",Nasdaq,LULD pause,2024-12-05,14:40:32
12/05/2024,14:24:50,ZSPC,"zSpace, Inc. Common stock",Nasdaq,LULD pause,2024-12-05,14:29:50
12/05/2024,14:23:38,RADX,Radiopharm Theranostics Limited American Depositary Shares,Nasdaq,LULD pause,2024-12-05,14:33:41
12/05/2024,14:19:00,ZSPC,"zSpace, Inc. Common stock",Nasdaq,LULD pause,2024-12-05,14:24:00
12/05/2024,14:17:24,RADX,Radiopharm Theranostics Limited American Depositary Shares,Nasdaq,LULD pause,2024-12-05,14:22:24
12/05/2024,14:12:46,ZSPC,"zSpace, Inc. Common stock",Nasdaq,LULD pause,2024-12-05,14:17:46
12/05/2024,14:07:35,SFHG,Samfine Creation Holdings Group Limited Ordinary Share,Nasdaq,LULD pause,2024-12-05,14:17:35
12/05/2024,14:06:51,ZSPC,"zSpace, Inc. Common stock",Nasdaq,LULD pause,2024-12-05,14:11:51
12/05/2024,13:52:49,ZSPC,"zSpace, Inc. Common stock",Nasdaq,LULD pause,2024-12-05,14:02:50
12/05/2024,13:47:12,ZSPC,"zSpace, Inc. Common stock",Nasdaq,LULD pause,2024-12-05,13:52:12
12/05/2024,13:46:27,GME,GameStop Corp. Class A,NYSE,LULD pause,2024-12-05,13:51:37
12/05/2024,13:36:54,ZSPC,"zSpace, Inc. Common stock",Nasdaq,LULD pause,2024-12-05,13:46:55
12/05/2024,13:33:44,ORIS,Oriental Rise Holdings Limited Ordinary Shares,Nasdaq,LULD pause,2024-12-05,16:00:00
12/05/2024,13:26:35,ZSPC,"zSpace, Inc. Common stock",Nasdaq,LULD pause,2024-12-05,13:36:36
12/05/2024,13:23:19,ORIS,Oriental Rise Holdings Limited Ordinary Shares,Nasdaq,LULD pause,2024-12-05,13:33:20
12/05/2024,13:16:15,ZSPC,"zSpace, Inc. Common stock",Nasdaq,LULD pause,2024-12-05,13:26:15
12/05/2024,13:12:59,ORIS,Oriental Rise Holdings Limited Ordinary Shares,Nasdaq,LULD pause,2024-12-05,13:22:59
12/05/2024,13:07:38,ORIS,Oriental Rise Holdings Limited Ordinary Shares,Nasdaq,LULD pause,2024-12-05,13:12:38
12/05/2024,13:05:49,ZSPC,"zSpace, Inc. Common stock",Nasdaq,LULD pause,2024-12-05,13:15:50
12/05/2024,13:00:15,ORIS,Oriental Rise Holdings Limited Ordinary Shares,Nasdaq,LULD pause,2024-12-05,13:05:15
12/05/2024,13:00:06,ZSPC,"zSpace, Inc. Common stock",Nasdaq,LULD pause,2024-12-05,13:05:06
12/05/2024,12:53:32,JYD,Jayud Global Logistics Limited Class A Ordinary Shares,Nasdaq,LULD pause,2024-12-05,12:58:32
12/05/2024,12:49:28,ZSPC,"zSpace, Inc. Common stock",Nasdaq,LULD pause,2024-12-05,12:59:29
12/05/2024,12:44:52,ORIS,Oriental Rise Holdings Limited Ordinary Shares,Nasdaq,LULD pause,2024-12-05,12:59:52
12/05/2024,12:39:03,ZSPC,"zSpace, Inc. Common stock",Nasdaq,LULD pause,2024-12-05,12:49:03
12/05/2024,12:34:13,ORIS,Oriental Rise Holdings Limited Ordinary Shares,Nasdaq,LULD pause,2024-12-05,12:44:13
12/05/2024,12:28:33,ZSPC,"zSpace, Inc. Common stock",Nasdaq,LULD pause,2024-12-05,12:38:33
12/05/2024,12:23:58,ORIS,Oriental Rise Holdings Limited Ordinary Shares,Nasdaq,LULD pause,2024-12-05,12:33:58
12/05/2024,12:18:20,ZSPC,"zSpace, Inc. Common stock",Nasdaq,LULD pause,2024-12-05,12:23:20
12/05/2024,12:07:31,ZSPC,"zSpace, Inc. Common stock",Nasdaq,LULD pause,2024-12-05,12:12:31
12/05/2024,11:59:54,ZSPC,"zSpace, Inc. Common stock",Nasdaq,LULD pause,2024-12-05,12:04:54
12/05/2024,11:52:04,JYD,Jayud Global Logistics Limited Class A Ordinary Shares,Nasdaq,LULD pause,2024-12-05,11:57:04
12/05/2024,11:49:07,ZSPC,"zSpace, Inc. Common stock",Nasdaq,LULD pause,2024-12-05,11:59:07
12/05/2024,11:37:18,ZSPC,"zSpace, Inc. Common stock",Nasdaq,LULD pause,2024-12-05,11:47:18
12/05/2024,11:27:15,PPBT,Purple Biotech Ltd. American Depositary Shares,Nasdaq,LULD pause,2024-12-05,11:32:15
12/05/2024,11:14:40,PPBT,Purple Biotech Ltd. American Depositary Shares,Nasdaq,LULD pause,2024-12-05,11:24:41
12/05/2024,11:11:25,WLYB,"John Wiley & Sons, Inc. Class B",NYSE,LULD pause,2024-12-05,11:17:16
12/05/2024,10:59:55,OPP PRC,"RiverNorth/DoubleLine Strategic Opportunity Fund, Inc. 6.00% Series C Term Preferred Stock (Liquidation Preference $10.00 per share)",NYSE American,LULD pause,2024-12-05,11:04:55
12/05/2024,10:59:08,GLE,Global Engine Group Holding Limited Ordinary Shares,Nasdaq,LULD pause,2024-12-05,11:04:08
12/05/2024,10:46:56,LNKS,Linkers Industries Limited Class A Ordinary Shares,Nasdaq,LULD pause,2024-12-05,10:51:56
12/05/2024,10:26:27,ARQQ,Arqit Quantum Inc. Ordinary Shares,Nasdaq,LULD pause,2024-12-05,10:31:27
12/05/2024,10:12:33,FOXX,Foxx Development Holdings Inc. Common Stock,Nasdaq,LULD pause,2024-12-05,10:22:33
12/05/2024,10:10:59,NTRP,"NextTrip, Inc. Common Stock",Nasdaq,LULD pause,2024-12-05,10:20:59
12/05/2024,10:10:38,GLE,Global Engine Group Holding Limited Ordinary Shares,Nasdaq,LULD pause,2024-12-05,10:20:38
12/05/2024,10:06:17,FOXX,Foxx Development Holdings Inc. Common Stock,Nasdaq,LULD pause,2024-12-05,10:11:17
12/05/2024,09:52:11,DIT,AMCON Distributing Co.,NYSE American,LULD pause,2024-12-05,09:57:11
12/05/2024,09:50:13,NTRP,"NextTrip, Inc. Common Stock",Nasdaq,LULD pause,2024-12-05,09:55:13
12/05/2024,09:44:27,TARA,"Protara Therapeutics, Inc. Common Stock",Nasdaq,LULD pause,2024-12-05,09:54:27
12/05/2024,09:42:02,MIGI,Mawson Infrastructure Group Inc. Common Stock,Nasdaq,LULD pause,2024-12-05,09:47:02
12/05/2024,09:37:27,FOXX,Foxx Development Holdings Inc. Common Stock,Nasdaq,LULD pause,2024-12-05,09:47:27
12/05/2024,09:35:58,HUHU,HUHUTECH International Group Inc. Ordinary Shares,Nasdaq,LULD pause,2024-12-05,09:40:58
12/05/2024,09:34:28,BJDX,"Bluejay Diagnostics, Inc. Common Stock",Nasdaq,LULD pause,2024-12-05,09:39:28
12/05/2024,09:31:06,FOXX,Foxx Development Holdings Inc. Common Stock,Nasdaq,LULD pause,2024-12-05,09:36:06
12/04/2024,19:50:00,AGRI,AgriFORCE Growing Systems Ltd. Common Shares,Nasdaq,News pending,2024-12-05,09:00:00
12/04/2024,19:50:00,AGRI,AgriFORCE Growing Systems Ltd. Common Shares,Nasdaq,News pending,,
12/04/2024,15:58:13,HTLM,HomesToLife Ltd Ordinary Shares,Nasdaq,LULD pause,2024-12-04,16:00:10
12/04/2024,15:45:03,UPXI,"Upexi, Inc. Common Stock",Nasdaq,LULD pause,2024-12-04,16:00:00
12/04/2024,15:37:39,NA,Nano Labs Ltd Class A Ordinary Shares,Nasdaq,LULD pause,2024-12-04,15:42:39
12/04/2024,15:32:37,HCTI,"Healthcare Triangle, Inc. Common Stock",Nasdaq,LULD pause,2024-12-04,15:37:37
12/04/2024,15:31:57,NA,Nano Labs Ltd Class A Ordinary Shares,Nasdaq,LULD pause,2024-12-04,15:36:57
12/04/2024,14:59:21,BOCN,Blue Ocean Acquisition Corp Class A Ordinary Shares,Nasdaq,LULD pause,2024-12-04,15:04:21
12/04/2024,14:45:48,SGN,"Signing Day Sports, Inc.",NYSE American,LULD pause,2024-12-04,14:50:48
12/04/2024,13:15:21,NLSP,NLS Pharmaceutics Ltd. Ordinary Shares,Nasdaq,LULD pause,2024-12-04,13:20:21
12/04/2024,12:53:14,CYCN,"Cyclerion Therapeutics, Inc. Common Stock",Nasdaq,LULD pause,2024-12-04,13:03:14
12/04/2024,11:28:09,HTLM,HomesToLife Ltd Ordinary Shares,Nasdaq,LULD pause,2024-12-04,11:33:09
12/04/2024,11:19:33,HUHU,HUHUTECH International Group Inc. Ordinary Shares,Nasdaq,LULD pause,2024-12-04,11:24:33
12/04/2024,11:08:43,HUHU,HUHUTECH International Group Inc. Ordinary Shares,Nasdaq,LULD pause,2024-12-04,11:18:43
12/04/2024,10:56:56,HUHU,HUHUTECH International Group Inc. Ordinary Shares,Nasdaq,LULD pause,2024-12-04,11:06:57
12/04/2024,10:46:27,HUHU,HUHUTECH International Group Inc. Ordinary Shares,Nasdaq,LULD pause,2024-12-04,10:56:27
12/04/2024,10:45:59,BOCNU,Blue Ocean Acquisition Corp Unit,Nasdaq,LULD pause,2024-12-04,10:50:59
12/04/2024,10:44:58,PW,Power REIT,NYSE American,LULD pause,2024-12-04,10:49:58
12/04/2024,10:39:57,HUHU,HUHUTECH International Group Inc. Ordinary Shares,Nasdaq,LULD pause,2024-12-04,10:44:57
12/04/2024,10:28:09,YIBO,Planet Image International Limited Class A Ordinary Shares,Nasdaq,LULD pause,2024-12-04,10:33:09
12/04/2024,10:19:33,HUHU,HUHUTECH International Group Inc. Ordinary Shares,Nasdaq,LULD pause,2024-12-04,10:39:34
12/04/2024,10:08:23,HUHU,HUHUTECH International Group Inc. Ordinary Shares,Nasdaq,LULD pause,2024-12-04,10:18:23
12/04/2024,10:01:42,ARBKL,Argo Blockchain plc 8.75% Senior Notes due 2026,Nasdaq,LULD pause,2024-12-04,10:06:42
12/04/2024,10:01:20,IMCC,IM Cannabis Corp. Common Shares,Nasdaq,LULD pause,2024-12-04,10:06:20
12/04/2024,09:38:49,CYCN,"Cyclerion Therapeutics, Inc. Common Stock",Nasdaq,LULD pause,2024-12-04,09:43:49
12/04/2024,09:37:29,NOTV,"Inotiv, Inc. Common Stock",Nasdaq,LULD pause,2024-12-04,09:42:29
12/04/2024,09:36:54,SRM,"SRM Entertainment, Inc. Common Stock",Nasdaq,LULD pause,2024-12-04,09:41:54
12/04/2024,09:35:17,AGFY,Agrify Corporation Common Stock,Nasdaq,LULD pause,2024-12-04,09:40:17
12/04/2024,09:32:37,XCUR,"Exicure, Inc. Common Stock",Nasdaq,LULD pause,2024-12-04,09:37:37
12/04/2024,09:31:25,SLND,"Southland Holdings, Inc.",NYSE American,LULD pause,2024-12-04,09:36:25
12/04/2024,09:30:59,SRM,"SRM Entertainment, Inc. Common Stock",Nasdaq,LULD pause,2024-12-04,09:35:59
12/04/2024,07:25:00,RLMD,"Relmada Therapeutics, Inc. Common Stock",Nasdaq,News pending,2024-12-04,08:00:00
12/03/2024,19:50:00,RNAZ,"TransCode Therapeutics, Inc. Common Stock",Nasdaq,News pending,2024-12-04,09:00:00
12/03/2024,19:50:00,RNAZ,"TransCode Therapeutics, Inc. Common Stock",Nasdaq,News pending,,
12/03/2024,19:50:00,APVO,Aptevo Therapeutics Inc,Nasdaq,News pending,2024-12-04,09:00:00
12/03/2024,19:50:00,APVO,Aptevo Therapeutics Inc,Nasdaq,News pending,,
12/03/2024,19:50:00,PMD,Psychemedics Corporation,Nasdaq,News pending,2024-12-04,09:00:00
12/03/2024,19:50:00,PMD,Psychemedics Corporation,Nasdaq,News pending,,
12/03/2024,16:47:02,ATIP,"ATI Physical Therapy, Inc.",NYSE,News Released,,
12/03/2024,16:09:48,ATIP,"ATI Physical Therapy, Inc.",NYSE,News pending,See Subsequent Halt,See Subsequent Halt
12/03/2024,15:47:52,ORIS,Oriental Rise Holdings Limited Ordinary Shares,Nasdaq,LULD pause,2024-12-03,16:00:00
12/03/2024,15:37:30,ORIS,Oriental Rise Holdings Limited Ordinary Shares,Nasdaq,LULD pause,2024-12-03,15:47:31
12/03/2024,15:27:14,ORIS,Oriental Rise Holdings Limited Ordinary Shares,Nasdaq,LULD pause,2024-12-03,15:37:14
12/03/2024,15:25:23,MSW,Ming Shing Group Holdings Limited Ordinary Shares,Nasdaq,LULD pause,2024-12-03,15:30:23
12/03/2024,14:23:22,ZJK,"ZJK Industrial Co., Ltd. Ordinary Shares",Nasdaq,LULD pause,2024-12-03,14:28:22
12/03/2024,13:11:52,PSQH,"PSQ Holdings, Inc.",NYSE,News pending,2024-12-03,13:37:18
12/03/2024,13:11:52,PSQH WS,"PSQ Holdings, Inc. Warrants, each exercisable for one share of Class A common stock at an exercise price of $11.50 per share",NYSE,News pending,2024-12-03,13:38:53
12/03/2024,12:58:11,JUNS,"Jupiter Neurosciences, Inc. Common Stock",Nasdaq,LULD pause,2024-12-03,13:03:11
12/03/2024,12:39:55,JUNS,"Jupiter Neurosciences, Inc. Common Stock",Nasdaq,LULD pause,2024-12-03,12:44:55
12/03/2024,12:28:32,JUNS,"Jupiter Neurosciences, Inc. Common Stock",Nasdaq,LULD pause,2024-12-03,12:33:32
12/03/2024,12:21:52,JUNS,"Jupiter Neurosciences, Inc. Common Stock",Nasdaq,LULD pause,2024-12-03,12:26:52
12/03/2024,12:11:13,JUNS,"Jupiter Neurosciences, Inc. Common Stock",Nasdaq,LULD pause,2024-12-03,12:16:13
12/03/2024,12:04:43,JUNS,"Jupiter Neurosciences, Inc. Common Stock",Nasdaq,LULD pause,2024-12-03,12:09:43
12/03/2024,11:59:24,JUNS,"Jupiter Neurosciences, Inc. Common Stock",Nasdaq,LULD pause,2024-12-03,12:04:24
12/03/2024,11:53:36,JUNS,"Jupiter Neurosciences, Inc. Common Stock",Nasdaq,LULD pause,2024-12-03,11:58:36
12/03/2024,11:43:09,JUNS,"Jupiter Neurosciences, Inc. Common Stock",Nasdaq,LULD pause,2024-12-03,11:53:10
12/03/2024,11:32:22,JUNS,"Jupiter Neurosciences, Inc. Common Stock",Nasdaq,LULD pause,2024-12-03,11:42:47
12/03/2024,11:26:11,JUNS,"Jupiter Neurosciences, Inc. Common Stock",Nasdaq,LULD pause,2024-12-03,11:31:11
12/03/2024,11:18:16,ZJK,"ZJK Industrial Co., Ltd. Ordinary Shares",Nasdaq,LULD pause,2024-12-03,11:23:16
12/03/2024,10:58:28,ZJK,"ZJK Industrial Co., Ltd. Ordinary Shares",Nasdaq,LULD pause,2024-12-03,11:03:28
12/03/2024,10:52:13,ZJK,"ZJK Industrial Co., Ltd. Ordinary Shares",Nasdaq,LULD pause,2024-12-03,10:57:13
12/03/2024,10:46:31,ZJK,"ZJK Industrial Co., Ltd. Ordinary Shares",Nasdaq,LULD pause,2024-12-03,10:51:31
12/03/2024,10:38:48,ZJK,"ZJK Industrial Co., Ltd. Ordinary Shares",Nasdaq,LULD pause,2024-12-03,10:43:48
12/03/2024,10:27:57,JYD,Jayud Global Logistics Limited Class A Ordinary Shares,Nasdaq,LULD pause,2024-12-03,10:32:57
12/03/2024,10:25:44,PTVE,Pactiv Evergreen Inc. Common stock,Nasdaq,LULD pause,2024-12-03,10:35:44
12/03/2024,10:22:08,JYD,Jayud Global Logistics Limited Class A Ordinary Shares,Nasdaq,LULD pause,2024-12-03,10:27:08
12/03/2024,10:19:21,ZJK,"ZJK Industrial Co., Ltd. Ordinary Shares",Nasdaq,LULD pause,2024-12-03,10:24:21
12/03/2024,10:13:18,ZJK,"ZJK Industrial Co., Ltd. Ordinary Shares",Nasdaq,LULD pause,2024-12-03,10:18:18
12/03/2024,10:06:37,ZJK,"ZJK Industrial Co., Ltd. Ordinary Shares",Nasdaq,LULD pause,2024-12-03,10:11:37
12/03/2024,09:55:42,ZJK,"ZJK Industrial Co., Ltd. Ordinary Shares",Nasdaq,LULD pause,2024-12-03,10:05:42
12/03/2024,09:52:30,NTRP,"NextTrip, Inc. Common Stock",Nasdaq,LULD pause,2024-12-03,09:57:30
12/03/2024,09:50:12,ZJK,"ZJK Industrial Co., Ltd. Ordinary Shares",Nasdaq,LULD pause,2024-12-03,09:55:12
12/03/2024,09:43:03,CANG,"Cango Inc. American Depositary Shares,  each representing two (2) Class A Ordinary Shares",NYSE,LULD pause,2024-12-03,09:48:05
12/03/2024,09:41:14,ZJK,"ZJK Industrial Co., Ltd. Ordinary Shares",Nasdaq,LULD pause,2024-12-03,09:46:14
12/03/2024,09:39:43,XCUR,"Exicure, Inc. Common Stock",Nasdaq,LULD pause,2024-12-03,09:44:43
12/03/2024,09:37:01,CANG,"Cango Inc. American Depositary Shares,  each representing two (2) Class A Ordinary Shares",NYSE,LULD pause,2024-12-03,09:42:24
12/03/2024,09:35:11,ZENA,"ZenaTech, Inc. Common Stock",Nasdaq,LULD pause,2024-12-03,09:40:11
12/03/2024,09:33:38,UAVS,"AgEagle Aerial Systems, Inc.",NYSE American,LULD pause,2024-12-03,09:38:38
12/03/2024,09:33:26,SNTI,"Senti Biosciences, Inc. Common Stock",Nasdaq,LULD pause,2024-12-03,09:38:26
12/03/2024,09:31:22,CANG,"Cango Inc. American Depositary Shares,  each representing two (2) Class A Ordinary Shares",NYSE,LULD pause,2024-12-03,09:36:34
12/03/2024,09:30:28,ZJK,"ZJK Industrial Co., Ltd. Ordinary Shares",Nasdaq,LULD pause,2024-12-03,09:40:28
12/03/2024,08:29:19,VZIO,VIZIO Holding Corp.,NYSE,Merger Effective,,
12/02/2024,19:50:00,MYNZ,Mainz Biomed N.V. Ordinary Shares,Nasdaq,News pending,2024-12-03,09:00:00
12/02/2024,19:50:00,MYNZ,Mainz Biomed N.V. Ordinary Shares,Nasdaq,News pending,,
12/02/2024,15:52:45,LPA,Logistic Properties of the Americas,NYSE American,LULD pause,2024-12-02,16:00:00
12/02/2024,15:42:46,LPA,Logistic Properties of the Americas,NYSE American,LULD pause,2024-12-02,15:47:46
12/02/2024,15:32:57,LPA,Logistic Properties of the Americas,NYSE American,LULD pause,2024-12-02,15:37:57
12/02/2024,14:42:49,MCN,Madison Covered Call & Equity Strategy Fund,NYSE,News pending,2024-12-02,16:25:48
12/02/2024,12:04:39,PPBT,Purple Biotech Ltd. American Depositary Shares,Nasdaq,LULD pause,2024-12-02,12:09:39
12/02/2024,11:44:55,QNRX,"Quoin Pharmaceuticals, Ltd. American Depositary Shares",Nasdaq,LULD pause,2024-12-02,11:54:55
12/02/2024,11:44:22,BGLC,BioNexus Gene Lab Corp Common stock,Nasdaq,LULD pause,2024-12-02,11:49:22
12/02/2024,11:36:56,JCSE,JE Cleantech Holdings Limited Ordinary Shares,Nasdaq,LULD pause,2024-12-02,11:41:56
12/02/2024,11:36:38,PPBT,Purple Biotech Ltd. American Depositary Shares,Nasdaq,LULD pause,2024-12-02,11:41:38
12/02/2024,11:33:58,QNRX,"Quoin Pharmaceuticals, Ltd. American Depositary Shares",Nasdaq,LULD pause,2024-12-02,11:38:58
12/02/2024,11:28:26,PPBT,Purple Biotech Ltd. American Depositary Shares,Nasdaq,LULD pause,2024-12-02,11:33:26
12/02/2024,11:20:21,QNRX,"Quoin Pharmaceuticals, Ltd. American Depositary Shares",Nasdaq,LULD pause,2024-12-02,11:25:21
12/02/2024,11:18:10,PPBT,Purple Biotech Ltd. American Depositary Shares,Nasdaq,LULD pause,2024-12-02,11:23:10
12/02/2024,11:11:37,PPBT,Purple Biotech Ltd. American Depositary Shares,Nasdaq,LULD pause,2024-12-02,11:16:37
12/02/2024,11:07:56,LIPO,Lipella Pharmaceuticals Inc. Common Stock,Nasdaq,LULD pause,2024-12-02,11:12:56
12/02/2024,10:58:01,PPBT,Purple Biotech Ltd. American Depositary Shares,Nasdaq,LULD pause,2024-12-02,11:08:02
12/02/2024,10:52:45,PPBT,Purple Biotech Ltd. American Depositary Shares,Nasdaq,LULD pause,2024-12-02,10:57:45
12/02/2024,10:52:22,LEV,The Lion Electric Company,NYSE,LULD pause,2024-12-02,10:57:49
12/02/2024,10:42:18,PPBT,Purple Biotech Ltd. American Depositary Shares,Nasdaq,LULD pause,2024-12-02,10:52:19
12/02/2024,10:36:17,IFBD,"Infobird Co., Ltd Ordinary Shares",Nasdaq,LULD pause,2024-12-02,10:41:17
12/02/2024,10:31:08,PPBT,Purple Biotech Ltd. American Depositary Shares,Nasdaq,LULD pause,2024-12-02,10:41:08
12/02/2024,10:20:08,PPBT,Purple Biotech Ltd. American Depositary Shares,Nasdaq,LULD pause,2024-12-02,10:30:08
12/02/2024,10:14:51,PPBT,Purple Biotech Ltd. American Depositary Shares,Nasdaq,LULD pause,2024-12-02,10:19:51
12/02/2024,10:13:50,UMAC,"Unusual Machines, Inc.",NYSE American,LULD pause,2024-12-02,10:18:50
12/02/2024,10:02:07,SNTI,"Senti Biosciences, Inc. Common Stock",Nasdaq,LULD pause,2024-12-02,10:07:07
12/02/2024,09:52:12,ARQQ,Arqit Quantum Inc. Ordinary Shares,Nasdaq,LULD pause,2024-12-02,09:57:12
12/02/2024,09:45:00,ARQQ,Arqit Quantum Inc. Ordinary Shares,Nasdaq,LULD pause,2024-12-02,09:50:00
12/02/2024,09:42:25,IFBD,"Infobird Co., Ltd Ordinary Shares",Nasdaq,LULD pause,2024-12-02,09:52:26
12/02/2024,09:41:33,UPXI,"Upexi, Inc. Common Stock",Nasdaq,LULD pause,2024-12-02,09:46:33
12/02/2024,09:40:43,UMAC,"Unusual Machines, Inc.",NYSE American,LULD pause,2024-12-02,09:45:43
12/02/2024,09:37:51,ARQQ,Arqit Quantum Inc. Ordinary Shares,Nasdaq,LULD pause,2024-12-02,09:42:51
12/02/2024,09:37:13,SDOT,Sadot Group Inc. Common Stock,Nasdaq,LULD pause,2024-12-02,09:50:37
12/02/2024,09:36:39,IMCC,IM Cannabis Corp. Common Shares,Nasdaq,LULD pause,2024-12-02,09:41:39
12/02/2024,09:34:35,PCTTU,"PureCycle Technologies, Inc. Unit",Nasdaq,LULD pause,2024-12-02,09:39:35
12/02/2024,09:32:33,ICLK,iClick Interactive Asia Group Limited,Nasdaq,LULD pause,2024-12-02,09:37:33
12/02/2024,09:32:24,VCIG,VCI Global Limited Ordinary Share,Nasdaq,LULD pause,2024-12-02,09:37:24
12/02/2024,09:30:17,BHST,BioHarvest Sciences Inc. Common Stock,Nasdaq,LULD pause,2024-12-02,09:35:17
12/02/2024,09:30:16,NCSM,"NCS Multistage Holdings, Inc.",Nasdaq,LULD pause,2024-12-02,09:40:16
11/29/2024,16:50:00,FTCI,"FTC Solar, Inc. Common Stock",Nasdaq,News pending,2024-12-02,09:00:00
11/29/2024,16:50:00,FTCI,"FTC Solar, Inc. Common Stock",Nasdaq,News pending,,
11/29/2024,16:50:00,LBPH,"Longboard Pharmaceuticals, Inc. Common Stock",Nasdaq,News pending,,
11/29/2024,14:26:12,MNTN,Everest Consolidator Acquisition Corporation,NYSE,News Released,,
11/29/2024,14:26:12,MNTN WS,"Everest Consolidator Acquisition Corporation Warrants, each whole warrant exercisable for one share of Class A Common Stock, at an exercise price of $",NYSE,News Released,,
11/29/2024,14:26:12,MNTN U,"Everest Consolidator Acquisition Corporation Units, each consisting of one share of Class A common stock and one-half of one redeemable warrant",NYSE,News Released,,
11/29/2024,13:06:11,MNTN WS,"Everest Consolidator Acquisition Corporation Warrants, each whole warrant exercisable for one share of Class A Common Stock, at an exercise price of $",NYSE,News pending,See Subsequent Halt,See Subsequent Halt
11/29/2024,13:06:11,MNTN,Everest Consolidator Acquisition Corporation,NYSE,News pending,See Subsequent Halt,See Subsequent Halt
11/29/2024,13:06:11,MNTN U,"Everest Consolidator Acquisition Corporation Units, each consisting of one share of Class A common stock and one-half of one redeemable warrant",NYSE,News pending,See Subsequent Halt,See Subsequent Halt
11/29/2024,11:49:11,PASG,"Passage Bio, Inc. Common Stock",Nasdaq,LULD pause,2024-11-29,11:54:11
11/29/2024,11:14:21,PRZO,ParaZero Technologies Ltd. Ordinary Shares,Nasdaq,LULD pause,2024-11-29,11:19:21
11/29/2024,11:06:06,UMAC,"Unusual Machines, Inc.",NYSE American,LULD pause,2024-11-29,11:11:06
11/29/2024,11:05:29,NDRA,ENDRA Life Sciences Inc. Common Stock,Nasdaq,LULD pause,2024-11-29,11:10:29
11/29/2024,11:01:00,SANW,S&W Seed Company,Nasdaq,LULD pause,2024-11-29,11:06:00
11/29/2024,10:23:07,PRZO,ParaZero Technologies Ltd. Ordinary Shares,Nasdaq,LULD pause,2024-11-29,10:28:07
11/29/2024,10:17:36,AIEV,"Thunder Power Holdings, Inc. Common Stock",Nasdaq,LULD pause,2024-11-29,10:22:36
11/29/2024,10:08:28,PRZO,ParaZero Technologies Ltd. Ordinary Shares,Nasdaq,LULD pause,2024-11-29,10:13:28
11/29/2024,10:05:59,SANW,S&W Seed Company,Nasdaq,LULD pause,2024-11-29,10:15:59
11/29/2024,10:03:57,AIEV,"Thunder Power Holdings, Inc. Common Stock",Nasdaq,LULD pause,2024-11-29,10:08:57
11/29/2024,09:43:30,RECT,Rectitude Holdings Ltd Ordinary Shares,Nasdaq,LULD pause,2024-11-29,09:53:30
11/29/2024,09:38:36,CABA,"Cabaletta Bio, Inc. Common Stock",Nasdaq,LULD pause,2024-11-29,09:43:36
11/29/2024,09:32:47,ICLK,iClick Interactive Asia Group Limited,Nasdaq,LULD pause,2024-11-29,09:37:47
11/29/2024,09:32:35,BGM,BGM Group Ltd. Class A Ordinary Shares,Nasdaq,LULD pause,2024-11-29,09:42:35
11/29/2024,09:32:10,PRZO,ParaZero Technologies Ltd. Ordinary Shares,Nasdaq,LULD pause,2024-11-29,09:37:10
11/29/2024,09:31:22,IMCC,IM Cannabis Corp. Common Shares,Nasdaq,LULD pause,2024-11-29,09:36:22
11/29/2024,09:30:19,GNTA,Genenta Science S.p.A. American Depositary Shares,Nasdaq,LULD pause,2024-11-29,09:40:19
11/27/2024,19:50:00,SLXNW,Silexion Therapeutics Corp Warrant,Nasdaq,News pending,2024-11-29,09:05:00
11/27/2024,19:50:00,SLXNW,Silexion Therapeutics Corp Warrant,Nasdaq,News pending,,
11/27/2024,19:50:00,SLXN,Silexion Therapeutics Corp Ordinary Shares,Nasdaq,News pending,2024-11-29,09:00:00
11/27/2024,19:50:00,SLXN,Silexion Therapeutics Corp Ordinary Shares,Nasdaq,News pending,,
11/27/2024,19:50:00,DBVT,DBV Technologies S.A.,Nasdaq,News pending,2024-11-29,09:00:00
11/27/2024,19:50:00,DBVT,DBV Technologies S.A.,Nasdaq,News pending,,
11/27/2024,16:05:00,APLT,"Applied Therapeutics, Inc. Common Stock",Nasdaq,News pending,2024-11-27,16:40:00
11/27/2024,15:22:06,PGHL,Primega Group Holdings Limited Ordinary Shares,Nasdaq,LULD pause,2024-11-27,15:27:06
11/27/2024,14:38:24,MOVE,Movano Inc. Common Stock,Nasdaq,LULD pause,2024-11-27,14:43:24
11/27/2024,14:12:20,PGHL,Primega Group Holdings Limited Ordinary Shares,Nasdaq,LULD pause,2024-11-27,14:17:20
11/27/2024,12:59:29,PGHL,Primega Group Holdings Limited Ordinary Shares,Nasdaq,LULD pause,2024-11-27,13:04:29
11/27/2024,12:59:22,MOVE,Movano Inc. Common Stock,Nasdaq,LULD pause,2024-11-27,13:04:22
11/27/2024,12:57:43,KDLY,"Kindly MD, Inc. Common Stock",Nasdaq,LULD pause,2024-11-27,13:02:43
11/27/2024,12:52:13,KDLY,"Kindly MD, Inc. Common Stock",Nasdaq,LULD pause,2024-11-27,12:57:13
11/27/2024,12:46:49,KDLY,"Kindly MD, Inc. Common Stock",Nasdaq,LULD pause,2024-11-27,12:51:49
11/27/2024,12:26:14,FOXX,Foxx Development Holdings Inc. Common Stock,Nasdaq,LULD pause,2024-11-27,12:31:14
11/27/2024,12:16:30,PGHL,Primega Group Holdings Limited Ordinary Shares,Nasdaq,LULD pause,2024-11-27,12:21:30
11/27/2024,12:11:17,SOS,"SOS Limited American Depositary Shares, one hundred and fifty (150) Class A Ordinary Shares",NYSE,LULD pause,2024-11-27,12:16:19
11/27/2024,12:04:56,SOS,"SOS Limited American Depositary Shares, one hundred and fifty (150) Class A Ordinary Shares",NYSE,LULD pause,2024-11-27,12:10:09
11/27/2024,12:02:38,FOXX,Foxx Development Holdings Inc. Common Stock,Nasdaq,LULD pause,2024-11-27,12:22:38
11/27/2024,11:59:48,PGHL,Primega Group Holdings Limited Ordinary Shares,Nasdaq,LULD pause,2024-11-27,12:09:48
11/27/2024,11:42:19,VCIG,VCI Global Limited Ordinary Share,Nasdaq,LULD pause,2024-11-27,11:47:19
11/27/2024,11:31:30,OTLK,"Outlook Therapeutics, Inc. Common Stock",Nasdaq,LULD pause,2024-11-27,11:36:30
11/27/2024,11:24:35,ABVE,Above Food Ingredients Inc. Common Stock,Nasdaq,LULD pause,2024-11-27,11:29:35
11/27/2024,11:16:00,ABVE,Above Food Ingredients Inc. Common Stock,Nasdaq,LULD pause,2024-11-27,11:21:00
11/27/2024,10:56:11,OTLK,"Outlook Therapeutics, Inc. Common Stock",Nasdaq,LULD pause,2024-11-27,11:01:11
11/27/2024,10:40:21,PGHL,Primega Group Holdings Limited Ordinary Shares,Nasdaq,LULD pause,2024-11-27,10:45:21
11/27/2024,10:34:07,BRIA,BrilliA Inc,NYSE American,LULD pause,2024-11-27,10:39:07
11/27/2024,10:31:40,PGHL,Primega Group Holdings Limited Ordinary Shares,Nasdaq,LULD pause,2024-11-27,10:36:40
11/27/2024,10:31:08,UMAC,"Unusual Machines, Inc.",NYSE American,LULD pause,2024-11-27,10:36:08
11/27/2024,10:26:16,SOS,"SOS Limited American Depositary Shares, one hundred and fifty (150) Class A Ordinary Shares",NYSE,LULD pause,2024-11-27,10:31:20
11/27/2024,10:19:16,SOS,"SOS Limited American Depositary Shares, one hundred and fifty (150) Class A Ordinary Shares",NYSE,LULD pause,2024-11-27,10:24:17
11/27/2024,10:10:02,PGHL,Primega Group Holdings Limited Ordinary Shares,Nasdaq,LULD pause,2024-11-27,10:15:02
11/27/2024,10:09:30,OTLK,"Outlook Therapeutics, Inc. Common Stock",Nasdaq,LULD pause,2024-11-27,10:14:30
11/27/2024,10:07:17,SOS,"SOS Limited American Depositary Shares, one hundred and fifty (150) Class A Ordinary Shares",NYSE,LULD pause,2024-11-27,10:12:18
11/27/2024,10:00:44,UMAC,"Unusual Machines, Inc.",NYSE American,LULD pause,2024-11-27,10:05:44
11/27/2024,10:00:05,PGHL,Primega Group Holdings Limited Ordinary Shares,Nasdaq,LULD pause,2024-11-27,10:05:05
11/27/2024,09:56:24,SOS,"SOS Limited American Depositary Shares, one hundred and fifty (150) Class A Ordinary Shares",NYSE,LULD pause,2024-11-27,10:01:26
11/27/2024,09:55:06,UMAC,"Unusual Machines, Inc.",NYSE American,LULD pause,2024-11-27,10:00:06
11/27/2024,09:53:56,SMTK,"SmartKem, Inc. Common Stock",Nasdaq,LULD pause,2024-11-27,09:58:56
11/27/2024,09:52:57,PGHL,Primega Group Holdings Limited Ordinary Shares,Nasdaq,LULD pause,2024-11-27,09:57:57
11/27/2024,09:50:47,SOS,"SOS Limited American Depositary Shares, one hundred and fifty (150) Class A Ordinary Shares",NYSE,LULD pause,2024-11-27,09:55:48
11/27/2024,09:49:14,UMAC,"Unusual Machines, Inc.",NYSE American,LULD pause,2024-11-27,09:54:14
11/27/2024,09:46:32,WAI,Top KingWin Ltd Class A Ordinary Shares,Nasdaq,LULD pause,2024-11-27,09:51:32
11/27/2024,09:44:56,SOS,"SOS Limited American Depositary Shares, one hundred and fifty (150) Class A Ordinary Shares",NYSE,LULD pause,2024-11-27,09:50:03
11/27/2024,09:41:02,WAI,Top KingWin Ltd Class A Ordinary Shares,Nasdaq,LULD pause,2024-11-27,09:46:02
11/27/2024,09:39:28,SOS,"SOS Limited American Depositary Shares, one hundred and fifty (150) Class A Ordinary Shares",NYSE,LULD pause,2024-11-27,09:44:36
11/27/2024,09:35:10,HURA,"TuHURA Biosciences, Inc. Common Stock",Nasdaq,LULD pause,2024-11-27,09:40:10
11/27/2024,09:35:02,WAI,Top KingWin Ltd Class A Ordinary Shares,Nasdaq,LULD pause,2024-11-27,09:40:02
11/27/2024,09:34:15,QMCO,Quantum Corporation,Nasdaq,LULD pause,2024-11-27,09:39:15
11/27/2024,09:33:34,SOS,"SOS Limited American Depositary Shares, one hundred and fifty (150) Class A Ordinary Shares",NYSE,LULD pause,2024-11-27,09:38:51
11/27/2024,09:33:14,PGHL,Primega Group Holdings Limited Ordinary Shares,Nasdaq,LULD pause,2024-11-27,09:38:14
11/27/2024,09:32:41,UMAC,"Unusual Machines, Inc.",NYSE American,LULD pause,2024-11-27,09:37:41
11/27/2024,09:32:13,PCTTU,"PureCycle Technologies, Inc. Unit",Nasdaq,LULD pause,2024-11-27,09:37:13
11/27/2024,08:41:23,VSTO,Vista Outdoor Inc.,NYSE,Merger Effective,,
11/26/2024,19:50:00,TSLQ,Investment Managers Series Trust II Tradr 2X Short TSLA Daily ETF,Nasdaq,News pending,2024-11-27,09:00:00
11/26/2024,19:50:00,TSLQ,Investment Managers Series Trust II Tradr 2X Short TSLA Daily ETF,Nasdaq,News pending,,
11/26/2024,19:50:00,ELAB,"Elevai Labs, Inc. Common Stock",Nasdaq,News pending,2024-11-27,09:00:00
11/26/2024,19:50:00,ELAB,"Elevai Labs, Inc. Common Stock",Nasdaq,News pending,,
11/26/2024,19:50:00,UBXG,U-BX Technology Ltd. Ordinary Shares,Nasdaq,News pending,2024-11-27,09:00:00
11/26/2024,19:50:00,UBXG,U-BX Technology Ltd. Ordinary Shares,Nasdaq,News pending,,
11/26/2024,19:50:00,SARK,Investment Managers Series Trust II Tradr 2X Short Innovation Daily ETF,Nasdaq,News pending,2024-11-27,09:00:00
11/26/2024,19:50:00,SARK,Investment Managers Series Trust II Tradr 2X Short Innovation Daily ETF,Nasdaq,News pending,,
11/26/2024,15:31:24,IMG,CIMG Inc. Common Stock,Nasdaq,LULD pause,2024-11-26,15:36:24
11/26/2024,15:20:45,IMG,CIMG Inc. Common Stock,Nasdaq,LULD pause,2024-11-26,15:25:45
11/26/2024,14:59:16,IMG,CIMG Inc. Common Stock,Nasdaq,LULD pause,2024-11-26,15:09:16
11/26/2024,14:52:23,MMS,"MAXIMUS, Inc.",NYSE,News pending,2024-11-26,16:22:00
11/26/2024,14:45:08,INAQU,Insight Acquisition Corp. Units,Nasdaq,LULD pause,2024-11-26,14:50:08
11/26/2024,14:34:16,GLE,Global Engine Group Holding Limited Ordinary Shares,Nasdaq,LULD pause,2024-11-26,14:39:16
11/26/2024,14:23:24,IMG,CIMG Inc. Common Stock,Nasdaq,LULD pause,2024-11-26,14:28:24
11/26/2024,14:15:33,GLE,Global Engine Group Holding Limited Ordinary Shares,Nasdaq,LULD pause,2024-11-26,14:20:33
11/26/2024,14:13:27,IMG,CIMG Inc. Common Stock,Nasdaq,LULD pause,2024-11-26,14:18:27
11/26/2024,14:07:28,GLE,Global Engine Group Holding Limited Ordinary Shares,Nasdaq,LULD pause,2024-11-26,14:12:28
11/26/2024,14:02:59,MDRRP,"Medalist Diversified REIT, Inc. Series A Cumulative Redeemable Preferred Stock",Nasdaq,LULD pause,2024-11-26,14:07:59
11/26/2024,14:00:55,GLE,Global Engine Group Holding Limited Ordinary Shares,Nasdaq,LULD pause,2024-11-26,14:05:55
11/26/2024,13:47:08,CCM,Concord Medical Services Holding Limited,NYSE,LULD pause,2024-11-26,13:52:12
11/26/2024,13:45:23,GLE,Global Engine Group Holding Limited Ordinary Shares,Nasdaq,LULD pause,2024-11-26,13:55:23
11/26/2024,13:20:05,PBM,Psyence Biomedical Ltd. Common Shares,Nasdaq,LULD pause,2024-11-26,13:25:05
11/26/2024,13:10:12,PBM,Psyence Biomedical Ltd. Common Shares,Nasdaq,LULD pause,2024-11-26,13:15:12
11/26/2024,12:48:18,IMG,CIMG Inc. Common Stock,Nasdaq,LULD pause,2024-11-26,12:53:18
11/26/2024,12:41:03,IMG,CIMG Inc. Common Stock,Nasdaq,LULD pause,2024-11-26,12:46:03
11/26/2024,12:14:49,IMG,CIMG Inc. Common Stock,Nasdaq,LULD pause,2024-11-26,12:19:49
11/26/2024,11:43:10,QMCO,Quantum Corporation,Nasdaq,LULD pause,2024-11-26,11:48:10
11/26/2024,11:33:28,QMCO,Quantum Corporation,Nasdaq,LULD pause,2024-11-26,11:38:28
11/26/2024,11:24:01,QMCO,Quantum Corporation,Nasdaq,LULD pause,2024-11-26,11:29:01
11/26/2024,11:03:51,QMCO,Quantum Corporation,Nasdaq,LULD pause,2024-11-26,11:08:51
11/26/2024,10:55:14,SANW,S&W Seed Company,Nasdaq,LULD pause,2024-11-26,11:00:14
11/26/2024,10:40:48,PDYN,Palladyne AI Corp. Common Stock,Nasdaq,LULD pause,2024-11-26,10:45:48
11/26/2024,10:38:37,HTLM,HomesToLife Ltd Ordinary Shares,Nasdaq,LULD pause,2024-11-26,10:43:37
11/26/2024,10:20:16,SANW,S&W Seed Company,Nasdaq,LULD pause,2024-11-26,10:25:16
11/26/2024,10:10:08,PCTTU,"PureCycle Technologies, Inc. Unit",Nasdaq,LULD pause,2024-11-26,10:15:08
11/26/2024,10:09:21,VSEE,"VSee Health, Inc. Common Stock",Nasdaq,LULD pause,2024-11-26,10:14:21
11/26/2024,09:58:56,ZJK,"ZJK Industrial Co., Ltd. Ordinary Shares",Nasdaq,LULD pause,2024-11-26,10:03:56
11/26/2024,09:48:26,PGHL,Primega Group Holdings Limited Ordinary Shares,Nasdaq,LULD pause,2024-11-26,16:00:00
11/26/2024,09:47:58,UAVS,"AgEagle Aerial Systems, Inc.",NYSE American,LULD pause,2024-11-26,09:52:58
11/26/2024,09:46:59,CTXR,Citius Pharmaceuticals Inc. Common,Nasdaq,LULD pause,2024-11-26,09:51:59
11/26/2024,09:44:05,ZENA,"ZenaTech, Inc. Common Stock",Nasdaq,LULD pause,2024-11-26,09:49:05
11/26/2024,09:42:21,PGHL,Primega Group Holdings Limited Ordinary Shares,Nasdaq,LULD pause,2024-11-26,09:47:21
11/26/2024,09:38:38,UAVS,"AgEagle Aerial Systems, Inc.",NYSE American,LULD pause,2024-11-26,09:43:38
11/26/2024,09:36:10,INAQ,Insight Acquisition Corp. Class A Common Stock,Nasdaq,LULD pause,2024-11-26,09:41:10
11/26/2024,09:34:59,SMTK,"SmartKem, Inc. Common Stock",Nasdaq,LULD pause,2024-11-26,09:39:59
11/26/2024,09:32:02,PGHL,Primega Group Holdings Limited Ordinary Shares,Nasdaq,LULD pause,2024-11-26,09:42:02
11/26/2024,09:32:01,CTXR,Citius Pharmaceuticals Inc. Common,Nasdaq,LULD pause,2024-11-26,09:42:01
11/26/2024,09:31:49,ZENA,"ZenaTech, Inc. Common Stock",Nasdaq,LULD pause,2024-11-26,09:41:49
11/25/2024,19:50:18,MSOX,AdvisorShares MSOS Daily Leveraged ETF,NYSE Arca,Corporate Action,2024-11-26,09:00:00
11/25/2024,19:50:18,MSOX,AdvisorShares MSOS Daily Leveraged ETF,NYSE Arca,Corporate Action,,
11/25/2024,19:50:00,PBMWW,Psyence Biomedical Ltd. Warrant,Nasdaq,News pending,2024-11-26,09:05:00
11/25/2024,19:50:00,PBMWW,Psyence Biomedical Ltd. Warrant,Nasdaq,News pending,,
11/25/2024,19:50:00,GMM,Global Mofy AI Limited Class A Ordinary Shares,Nasdaq,News pending,2024-11-26,09:00:00
11/25/2024,19:50:00,GMM,Global Mofy AI Limited Class A Ordinary Shares,Nasdaq,News pending,,
11/25/2024,19:50:00,CTXR,Citius Pharmaceuticals Inc. Common,Nasdaq,News pending,2024-11-26,09:00:00
11/25/2024,19:50:00,CTXR,Citius Pharmaceuticals Inc. Common,Nasdaq,News pending,,
11/25/2024,19:50:00,CETX,CEMTREX INC.,Nasdaq,News pending,2024-11-26,09:00:00
11/25/2024,19:50:00,CETX,CEMTREX INC.,Nasdaq,News pending,,
11/25/2024,19:50:00,PBM,Psyence Biomedical Ltd. Common Shares,Nasdaq,News pending,2024-11-26,09:00:00
11/25/2024,19:50:00,PBM,Psyence Biomedical Ltd. Common Shares,Nasdaq,News pending,,
11/25/2024,17:53:28,NVX,NOVONIX Limited American Depository Shares,Nasdaq,News pending,2024-11-26,18:35:00
11/25/2024,17:53:28,NVX,NOVONIX Limited American Depository Shares,Nasdaq,News pending,,
11/25/2024,15:31:51,MFH,Mercurity Fintech Holding Inc. Ordinary Shares,Nasdaq,LULD pause,2024-11-25,15:46:52
11/25/2024,15:20:45,MFH,Mercurity Fintech Holding Inc. Ordinary Shares,Nasdaq,LULD pause,2024-11-25,15:30:45
11/25/2024,14:23:41,STFS,Star Fashion Culture Holdings Limited Class A Ordinary Shares,Nasdaq,LULD pause,2024-11-25,14:28:41
11/25/2024,13:39:42,HTLM,HomesToLife Ltd Ordinary Shares,Nasdaq,LULD pause,2024-11-25,13:44:42
11/25/2024,13:29:49,HTLM,HomesToLife Ltd Ordinary Shares,Nasdaq,LULD pause,2024-11-25,13:34:49
11/25/2024,11:25:38,LSH,Lakeside Holding Limited Common Stock,Nasdaq,LULD pause,2024-11-25,11:30:38
11/25/2024,10:54:21,MFH,Mercurity Fintech Holding Inc. Ordinary Shares,Nasdaq,LULD pause,2024-11-25,11:04:21
11/25/2024,10:48:10,MFH,Mercurity Fintech Holding Inc. Ordinary Shares,Nasdaq,LULD pause,2024-11-25,10:53:10
11/25/2024,10:44:55,XCUR,"Exicure, Inc. Common Stock",Nasdaq,LULD pause,2024-11-25,10:49:55
11/25/2024,10:37:21,QMCO,Quantum Corporation,Nasdaq,LULD pause,2024-11-25,10:42:21
11/25/2024,10:36:20,SMTK,"SmartKem, Inc. Common Stock",Nasdaq,LULD pause,2024-11-25,10:41:20
11/25/2024,10:29:53,SMTK,"SmartKem, Inc. Common Stock",Nasdaq,LULD pause,2024-11-25,10:34:53
11/25/2024,10:24:23,QMCO,Quantum Corporation,Nasdaq,LULD pause,2024-11-25,10:29:23
11/25/2024,10:16:09,QMCO,Quantum Corporation,Nasdaq,LULD pause,2024-11-25,10:21:09
11/25/2024,10:10:10,QMCO,Quantum Corporation,Nasdaq,LULD pause,2024-11-25,10:15:10
11/25/2024,10:06:15,PCTTU,"PureCycle Technologies, Inc. Unit",Nasdaq,LULD pause,2024-11-25,10:11:15
11/25/2024,10:03:56,QMCO,Quantum Corporation,Nasdaq,LULD pause,2024-11-25,10:08:56
11/25/2024,10:00:51,QMMM,QMMM Holdings Limited Ordinary Shares,Nasdaq,LULD pause,2024-11-25,10:05:51
11/25/2024,09:55:09,SANW,S&W Seed Company,Nasdaq,LULD pause,2024-11-25,10:00:09
11/25/2024,09:53:47,QMCO,Quantum Corporation,Nasdaq,LULD pause,2024-11-25,09:58:47
11/25/2024,09:50:24,QMMM,QMMM Holdings Limited Ordinary Shares,Nasdaq,LULD pause,2024-11-25,09:55:24
11/25/2024,09:48:40,MFH,Mercurity Fintech Holding Inc. Ordinary Shares,Nasdaq,LULD pause,2024-11-25,09:53:40
11/25/2024,09:45:55,PCTTU,"PureCycle Technologies, Inc. Unit",Nasdaq,LULD pause,2024-11-25,09:50:55
11/25/2024,09:45:44,PROC,"Procaps Group, S.A. Ordinary Shares",Nasdaq,LULD pause,2024-11-25,09:50:44
11/25/2024,09:43:40,QMMM,QMMM Holdings Limited Ordinary Shares,Nasdaq,LULD pause,2024-11-25,09:48:40
11/25/2024,09:39:30,YYAI,Connexa Sports Technologies Inc. Common Stock,Nasdaq,LULD pause,2024-11-25,09:44:30
11/25/2024,09:37:35,PDYN,Palladyne AI Corp. Common Stock,Nasdaq,LULD pause,2024-11-25,09:42:35
11/25/2024,09:36:18,QMMM,QMMM Holdings Limited Ordinary Shares,Nasdaq,LULD pause,2024-11-25,09:41:18
11/25/2024,09:33:04,SANW,S&W Seed Company,Nasdaq,LULD pause,2024-11-25,09:53:07
11/25/2024,09:32:58,UXIN,Uxin Limited ADS,Nasdaq,LULD pause,2024-11-25,09:42:58
11/25/2024,09:30:43,QMMM,QMMM Holdings Limited Ordinary Shares,Nasdaq,LULD pause,2024-11-25,09:35:43
11/25/2024,08:53:00,KODK,EASTMAN KODAK COMPANY,NYSE,News pending,2024-11-25,09:33:06
11/25/2024,08:25:44,ENV,"ENVESTNET, INC.",NYSE,Merger Effective,,
11/25/2024,07:55:00,BCOV,"Brightcove, Inc.",Nasdaq,News pending,2024-11-25,08:30:00
11/25/2024,07:25:00,SAVA,"Cassava Sciences, Inc.",Nasdaq,News pending,2024-11-25,08:00:00
11/22/2024,19:50:54,GPUS,"Hyperscale Data, Inc.",NYSE American,Corporate Action,2024-11-25,09:00:00
11/22/2024,19:50:54,GPUS,"Hyperscale Data, Inc.",NYSE American,Corporate Action,,
11/22/2024,19:50:00,APLMW,Apollomics Inc. Warrant,Nasdaq,News pending,2024-11-25,09:05:00
11/22/2024,19:50:00,APLMW,Apollomics Inc. Warrant,Nasdaq,News pending,,
11/22/2024,19:50:00,APLM,Apollomics Inc. Class A Ordinary Shares,Nasdaq,News pending,2024-11-25,09:00:00
11/22/2024,19:50:00,APLM,Apollomics Inc. Class A Ordinary Shares,Nasdaq,News pending,,
11/22/2024,16:08:53,BBIO,"BridgeBio Pharma, Inc. Common Stock",Nasdaq,News pending,2024-11-25,07:10:00
11/22/2024,16:08:53,BBIO,"BridgeBio Pharma, Inc. Common Stock",Nasdaq,News pending,,
11/22/2024,15:35:23,YYAI,Connexa Sports Technologies Inc. Common Stock,Nasdaq,LULD pause,2024-11-22,15:40:23
11/22/2024,14:03:09,INAQU,Insight Acquisition Corp. Units,Nasdaq,LULD pause,2024-11-22,14:08:09
11/22/2024,13:59:37,QMCO,Quantum Corporation,Nasdaq,LULD pause,2024-11-22,14:04:37
11/22/2024,13:57:29,YYAI,Connexa Sports Technologies Inc. Common Stock,Nasdaq,LULD pause,2024-11-22,14:10:34
11/22/2024,13:51:56,YYAI,Connexa Sports Technologies Inc. Common Stock,Nasdaq,LULD pause,2024-11-22,13:56:56
11/22/2024,11:27:25,QMMM,QMMM Holdings Limited Ordinary Shares,Nasdaq,LULD pause,2024-11-22,11:32:25
11/22/2024,11:20:26,QMCO,Quantum Corporation,Nasdaq,LULD pause,2024-11-22,11:25:26
11/22/2024,11:13:46,NA,Nano Labs Ltd Class A Ordinary Shares,Nasdaq,LULD pause,2024-11-22,11:18:46
11/22/2024,11:06:03,NA,Nano Labs Ltd Class A Ordinary Shares,Nasdaq,LULD pause,2024-11-22,11:11:03
11/22/2024,10:45:59,PTLE,PTL LTD Ordinary Shares,Nasdaq,LULD pause,2024-11-22,10:50:59
11/22/2024,10:45:17,QMCO,Quantum Corporation,Nasdaq,LULD pause,2024-11-22,10:55:17
11/22/2024,10:34:09,QMCO,Quantum Corporation,Nasdaq,LULD pause,2024-11-22,10:44:09
11/22/2024,09:56:00,DEVS,DevvStream Corp. Common Stock,Nasdaq,LULD pause,2024-11-22,10:01:00
11/22/2024,09:53:58,IZTC,Invizyne Technologies Inc. Common Stock,Nasdaq,LULD pause,2024-11-22,09:58:58
11/22/2024,09:46:10,XCUR,"Exicure, Inc. Common Stock",Nasdaq,LULD pause,2024-11-22,09:51:10
11/22/2024,09:37:03,ARQQ,Arqit Quantum Inc. Ordinary Shares,Nasdaq,LULD pause,2024-11-22,09:42:03
11/22/2024,09:31:35,SANW,S&W Seed Company,Nasdaq,LULD pause,2024-11-22,09:36:35
11/22/2024,08:34:50,ARC,"ARC Document Solutions, Inc.",NYSE,Merger Effective,,
11/22/2024,08:26:45,MRO,Marathon Oil Corporation,NYSE,Merger Effective,,
11/21/2024,19:50:00,DFLIW,Dragonfly Energy Holdings Corp. Warrant,Nasdaq,News pending,2024-11-22,09:05:00
11/21/2024,19:50:00,DFLIW,Dragonfly Energy Holdings Corp. Warrant,Nasdaq,News pending,,
11/21/2024,19:50:00,DFLI,Dragonfly Energy Holdings Corp. Common Stock (NV),Nasdaq,News pending,2024-11-22,09:00:00
11/21/2024,19:50:00,DFLI,Dragonfly Energy Holdings Corp. Common Stock (NV),Nasdaq,News pending,,
11/21/2024,19:50:00,XTKG,"X3 Holdings Co., Ltd. Ordinary Shares",Nasdaq,News pending,2024-11-22,09:00:00
11/21/2024,19:50:00,XTKG,"X3 Holdings Co., Ltd. Ordinary Shares",Nasdaq,News pending,,
11/21/2024,15:51:48,SKK,SKK Holdings Limited Common Stock,Nasdaq,LULD pause,2024-11-21,16:00:00
11/21/2024,15:38:51,WCT,Wellchange Holdings Company Limited Ordinary shares,Nasdaq,LULD pause,2024-11-21,15:43:51
11/21/2024,15:38:51,SKK,SKK Holdings Limited Common Stock,Nasdaq,LULD pause,2024-11-21,15:43:51
11/21/2024,14:36:57,SKK,SKK Holdings Limited Common Stock,Nasdaq,LULD pause,2024-11-21,14:41:57
11/21/2024,14:23:40,SKK,SKK Holdings Limited Common Stock,Nasdaq,LULD pause,2024-11-21,14:28:40
11/21/2024,14:16:35,WCT,Wellchange Holdings Company Limited Ordinary shares,Nasdaq,LULD pause,2024-11-21,14:21:35
11/21/2024,14:00:56,WCT,Wellchange Holdings Company Limited Ordinary shares,Nasdaq,LULD pause,2024-11-21,14:05:56
11/21/2024,13:52:38,SKK,SKK Holdings Limited Common Stock,Nasdaq,LULD pause,2024-11-21,13:57:38
11/21/2024,13:37:09,SKK,SKK Holdings Limited Common Stock,Nasdaq,LULD pause,2024-11-21,13:42:09
11/21/2024,13:21:53,TMTC,TMT Acquisition Corp Ordinary Shares,Nasdaq,LULD pause,2024-11-21,13:26:53
11/21/2024,13:21:47,TMTCU,TMT Acquisition Corp Unit,Nasdaq,LULD pause,2024-11-21,13:48:39
11/21/2024,13:20:53,SKK,SKK Holdings Limited Common Stock,Nasdaq,LULD pause,2024-11-21,13:25:53
11/21/2024,13:20:15,PROC,"Procaps Group, S.A. Ordinary Shares",Nasdaq,LULD pause,2024-11-21,13:25:15
11/21/2024,13:16:33,TMTC,TMT Acquisition Corp Ordinary Shares,Nasdaq,LULD pause,2024-11-21,13:21:33
11/21/2024,13:10:56,PROC,"Procaps Group, S.A. Ordinary Shares",Nasdaq,LULD pause,2024-11-21,13:15:56
11/21/2024,13:05:52,TMTC,TMT Acquisition Corp Ordinary Shares,Nasdaq,LULD pause,2024-11-21,13:15:53
11/21/2024,12:54:57,TMTC,TMT Acquisition Corp Ordinary Shares,Nasdaq,LULD pause,2024-11-21,12:59:57
11/21/2024,12:19:42,SKK,SKK Holdings Limited Common Stock,Nasdaq,LULD pause,2024-11-21,12:24:42
11/21/2024,12:14:37,WCT,Wellchange Holdings Company Limited Ordinary shares,Nasdaq,LULD pause,2024-11-21,12:19:37
11/21/2024,12:13:57,SKK,SKK Holdings Limited Common Stock,Nasdaq,LULD pause,2024-11-21,12:18:57
11/21/2024,12:07:11,QMCO,Quantum Corporation,Nasdaq,LULD pause,2024-11-21,12:12:11
11/21/2024,12:06:54,SKK,SKK Holdings Limited Common Stock,Nasdaq,LULD pause,2024-11-21,12:11:54
11/21/2024,11:52:26,QMCO,Quantum Corporation,Nasdaq,LULD pause,2024-11-21,12:02:26
11/21/2024,11:52:09,SKK,SKK Holdings Limited Common Stock,Nasdaq,LULD pause,2024-11-21,11:57:09
11/21/2024,11:47:33,GLXG,Galaxy Payroll Group Limited Ordinary Shares,Nasdaq,LULD pause,2024-11-21,11:52:33
11/21/2024,11:40:44,GLXG,Galaxy Payroll Group Limited Ordinary Shares,Nasdaq,LULD pause,2024-11-21,11:45:44
11/21/2024,11:39:38,SKK,SKK Holdings Limited Common Stock,Nasdaq,LULD pause,2024-11-21,11:44:38
11/21/2024,11:32:47,GLXG,Galaxy Payroll Group Limited Ordinary Shares,Nasdaq,LULD pause,2024-11-21,11:37:47
11/21/2024,11:25:37,GLXG,Galaxy Payroll Group Limited Ordinary Shares,Nasdaq,LULD pause,2024-11-21,11:30:37
11/21/2024,11:16:19,SKK,SKK Holdings Limited Common Stock,Nasdaq,LULD pause,2024-11-21,11:21:19
11/21/2024,11:14:20,GLXG,Galaxy Payroll Group Limited Ordinary Shares,Nasdaq,LULD pause,2024-11-21,11:19:20
11/21/2024,11:12:32,BDRX,Biodexa Pharmaceuticals plc American Depositary Shs,Nasdaq,LULD pause,2024-11-21,11:17:32
11/21/2024,11:11:51,SANW,S&W Seed Company,Nasdaq,LULD pause,2024-11-21,11:16:51
11/21/2024,11:09:38,SKK,SKK Holdings Limited Common Stock,Nasdaq,LULD pause,2024-11-21,11:14:38
11/21/2024,11:06:34,GLXG,Galaxy Payroll Group Limited Ordinary Shares,Nasdaq,LULD pause,2024-11-21,11:11:34
11/21/2024,11:03:37,SKK,SKK Holdings Limited Common Stock,Nasdaq,LULD pause,2024-11-21,11:08:37
11/21/2024,11:00:21,SAIH,SAIHEAT Limited Class A Ordinary Shares,Nasdaq,LULD pause,2024-11-21,11:05:21
11/21/2024,10:59:58,GLXG,Galaxy Payroll Group Limited Ordinary Shares,Nasdaq,LULD pause,2024-11-21,11:04:58
11/21/2024,10:55:01,SKK,SKK Holdings Limited Common Stock,Nasdaq,LULD pause,2024-11-21,11:00:01
11/21/2024,10:54:43,BDRX,Biodexa Pharmaceuticals plc American Depositary Shs,Nasdaq,LULD pause,2024-11-21,11:04:43
11/21/2024,10:49:09,BDRX,Biodexa Pharmaceuticals plc American Depositary Shs,Nasdaq,LULD pause,2024-11-21,10:54:09
11/21/2024,10:48:35,SANW,S&W Seed Company,Nasdaq,LULD pause,2024-11-21,10:58:36
11/21/2024,10:48:29,SKK,SKK Holdings Limited Common Stock,Nasdaq,LULD pause,2024-11-21,10:53:29
11/21/2024,10:46:34,XCUR,"Exicure, Inc. Common Stock",Nasdaq,LULD pause,2024-11-21,10:51:34
11/21/2024,10:41:53,SKK,SKK Holdings Limited Common Stock,Nasdaq,LULD pause,2024-11-21,10:46:53
11/21/2024,10:38:34,SANW,S&W Seed Company,Nasdaq,LULD pause,2024-11-21,10:43:34
11/21/2024,10:18:22,LDWY,"Lendway, Inc. Common Stock (DE)",Nasdaq,LULD pause,2024-11-21,10:23:22
11/21/2024,10:09:20,SKK,SKK Holdings Limited Common Stock,Nasdaq,LULD pause,2024-11-21,10:14:20
11/21/2024,09:53:02,SKK,SKK Holdings Limited Common Stock,Nasdaq,LULD pause,2024-11-21,09:58:02
11/21/2024,09:50:32,IBG,Innovation Beverage Group Limited Ordinary Shares,Nasdaq,LULD pause,2024-11-21,09:55:32
11/21/2024,09:47:07,SKK,SKK Holdings Limited Common Stock,Nasdaq,LULD pause,2024-11-21,09:52:07
11/21/2024,09:44:34,WORX,SC WORX Corp,Nasdaq,LULD pause,2024-11-21,09:49:34
11/21/2024,09:43:25,CATX,"Perspective Therapeutics, Inc.",NYSE American,LULD pause,2024-11-21,09:48:25
11/21/2024,09:40:55,PRFX,PainReform Ltd. Ordinary Shares,Nasdaq,LULD pause,2024-11-21,09:45:55
11/21/2024,09:40:53,SKK,SKK Holdings Limited Common Stock,Nasdaq,LULD pause,2024-11-21,09:45:53
11/21/2024,09:40:39,RMSG,Real Messenger Corporation Ordinary Shares,Nasdaq,LULD pause,2024-11-21,09:45:39
11/21/2024,09:36:50,AHT,"Ashford Hospitality Trust, Inc.",NYSE,LULD pause,2024-11-21,09:41:53
11/21/2024,09:36:12,UPLD,"Upland Software, Inc.",Nasdaq,LULD pause,2024-11-21,09:41:12
11/21/2024,09:34:42,RMSG,Real Messenger Corporation Ordinary Shares,Nasdaq,LULD pause,2024-11-21,09:39:42
11/21/2024,09:34:34,TCS,"THE CONTAINER STORE GROUP, INC.",NYSE,LULD pause,2024-11-21,09:39:42
11/21/2024,09:31:57,TRAW,"Traws Pharma, Inc. Common Stock",Nasdaq,LULD pause,2024-11-21,09:36:57
11/21/2024,09:31:38,SPAI,Safe Pro Group Inc. Common Stock,Nasdaq,LULD pause,2024-11-21,09:41:38
11/21/2024,09:31:28,PRFX,PainReform Ltd. Ordinary Shares,Nasdaq,LULD pause,2024-11-21,09:36:28
11/21/2024,09:30:23,SKK,SKK Holdings Limited Common Stock,Nasdaq,LULD pause,2024-11-21,09:40:23
11/21/2024,09:30:16,BNDC,FlexShares Core Select Bond Fund,NYSE Arca,LULD pause,2024-11-21,09:35:16
11/21/2024,08:35:56,BLEUW,bleuacacia ltd Warrants,Nasdaq,News pending,2024-11-21,09:20:00
11/21/2024,08:35:56,BLEUU,bleuacacia ltd Unit,Nasdaq,News pending,2024-11-21,09:20:00
11/21/2024,08:35:56,BLEUR,bleuacacia ltd Rights,Nasdaq,News pending,2024-11-21,09:20:00
11/21/2024,08:35:56,BLEU,bleuacacia ltd Class A Ordinary Shares,Nasdaq,News pending,2024-11-21,09:15:00
11/20/2024,19:50:00,NMHIW,Natures Miracle Holding Inc. Warrants,Nasdaq,News pending,2024-11-21,09:05:00
11/20/2024,19:50:00,NMHIW,Natures Miracle Holding Inc. Warrants,Nasdaq,News pending,,
11/20/2024,19:50:00,HAYN,"Haynes International, Inc.",Nasdaq,News pending,,
11/20/2024,19:50:00,LAZR,"Luminar Technologies, Inc. Class A Common Stock",Nasdaq,News pending,2024-11-21,09:00:00
11/20/2024,19:50:00,LAZR,"Luminar Technologies, Inc. Class A Common Stock",Nasdaq,News pending,,
11/20/2024,19:50:00,NMHI,Natures Miracle Holding Inc. Common Stock,Nasdaq,News pending,2024-11-21,09:00:00
11/20/2024,19:50:00,NMHI,Natures Miracle Holding Inc. Common Stock,Nasdaq,News pending,,
11/20/2024,19:50:00,PRFX,PainReform Ltd. Ordinary Shares,Nasdaq,News pending,2024-11-21,09:00:00
11/20/2024,19:50:00,PRFX,PainReform Ltd. Ordinary Shares,Nasdaq,News pending,,
11/20/2024,15:48:36,NDRA,ENDRA Life Sciences Inc. Common Stock,Nasdaq,LULD pause,2024-11-20,16:00:00
11/20/2024,15:42:56,SKK,SKK Holdings Limited Common Stock,Nasdaq,LULD pause,2024-11-20,15:47:56
11/20/2024,15:37:47,NDRA,ENDRA Life Sciences Inc. Common Stock,Nasdaq,LULD pause,2024-11-20,15:47:47
11/20/2024,15:18:06,UPXI,"Upexi, Inc. Common Stock",Nasdaq,LULD pause,2024-11-20,15:28:06
11/20/2024,15:02:39,UPXI,"Upexi, Inc. Common Stock",Nasdaq,LULD pause,2024-11-20,15:12:40
11/20/2024,14:56:40,ZETA,Zeta Global Holdings Corp.,NYSE,News pending,2024-11-20,15:18:45
11/20/2024,12:31:02,RMSG,Real Messenger Corporation Ordinary Shares,Nasdaq,LULD pause,2024-11-20,12:36:02
11/20/2024,12:01:03,VLCN,"Volcon, Inc. Common stock",Nasdaq,LULD pause,2024-11-20,12:06:03
11/20/2024,11:58:18,RMSG,Real Messenger Corporation Ordinary Shares,Nasdaq,LULD pause,2024-11-20,12:03:18
11/20/2024,11:52:41,RMSG,Real Messenger Corporation Ordinary Shares,Nasdaq,LULD pause,2024-11-20,11:57:41
11/20/2024,11:43:25,RMSG,Real Messenger Corporation Ordinary Shares,Nasdaq,LULD pause,2024-11-20,11:48:25
11/20/2024,11:37:12,RMSG,Real Messenger Corporation Ordinary Shares,Nasdaq,LULD pause,2024-11-20,11:42:12
11/20/2024,11:34:46,XCUR,"Exicure, Inc. Common Stock",Nasdaq,LULD pause,2024-11-20,11:39:46
11/20/2024,11:17:37,XCUR,"Exicure, Inc. Common Stock",Nasdaq,LULD pause,2024-11-20,11:22:37
11/20/2024,10:52:01,FBRX,"Forte Biosciences, Inc. Common Stock",Nasdaq,LULD pause,2024-11-20,10:57:01
11/20/2024,10:52:00,SEM WI,Select Medical Holdings Corporation,NYSE,LULD pause,2024-11-20,10:59:49
11/20/2024,10:31:10,FBRX,"Forte Biosciences, Inc. Common Stock",Nasdaq,LULD pause,2024-11-20,10:36:10
11/20/2024,10:23:18,XCUR,"Exicure, Inc. Common Stock",Nasdaq,LULD pause,2024-11-20,10:28:18
11/20/2024,10:20:33,FBRX,"Forte Biosciences, Inc. Common Stock",Nasdaq,LULD pause,2024-11-20,10:30:33
11/20/2024,10:14:34,MDAI,"Spectral AI, Inc. Class A Common Stock",Nasdaq,LULD pause,2024-11-20,10:19:34
11/20/2024,10:12:51,FBRX,"Forte Biosciences, Inc. Common Stock",Nasdaq,LULD pause,2024-11-20,10:17:51
11/20/2024,10:09:34,QSI,Quantum-Si Incorporated Class A Common Stock,Nasdaq,LULD pause,2024-11-20,10:14:34
11/20/2024,10:03:39,RMSG,Real Messenger Corporation Ordinary Shares,Nasdaq,LULD pause,2024-11-20,10:08:39
11/20/2024,10:01:41,FBRX,"Forte Biosciences, Inc. Common Stock",Nasdaq,LULD pause,2024-11-20,10:11:41
11/20/2024,09:59:09,MDAI,"Spectral AI, Inc. Class A Common Stock",Nasdaq,LULD pause,2024-11-20,10:04:09
11/20/2024,09:57:13,QSI,Quantum-Si Incorporated Class A Common Stock,Nasdaq,LULD pause,2024-11-20,10:02:13
11/20/2024,09:56:15,FBRX,"Forte Biosciences, Inc. Common Stock",Nasdaq,LULD pause,2024-11-20,10:01:15
11/20/2024,09:54:25,RMSG,Real Messenger Corporation Ordinary Shares,Nasdaq,LULD pause,2024-11-20,09:59:25
11/20/2024,09:49:04,QSI,Quantum-Si Incorporated Class A Common Stock,Nasdaq,LULD pause,2024-11-20,09:54:04
11/20/2024,09:48:44,RMSG,Real Messenger Corporation Ordinary Shares,Nasdaq,LULD pause,2024-11-20,09:53:44
11/20/2024,09:46:18,DNMR,"Danimer Scientific, Inc.",NYSE,LULD pause,2024-11-20,09:51:30
11/20/2024,09:42:27,RMSG,Real Messenger Corporation Ordinary Shares,Nasdaq,LULD pause,2024-11-20,09:47:27
11/20/2024,09:38:35,QSI,Quantum-Si Incorporated Class A Common Stock,Nasdaq,LULD pause,2024-11-20,09:43:35
11/20/2024,09:37:04,RMSG,Real Messenger Corporation Ordinary Shares,Nasdaq,LULD pause,2024-11-20,09:42:04
11/20/2024,09:33:32,EDRY,EuroDry Ltd. Common Shares,Nasdaq,LULD pause,2024-11-20,09:38:32
11/20/2024,09:32:23,QSI,Quantum-Si Incorporated Class A Common Stock,Nasdaq,LULD pause,2024-11-20,09:37:23
11/20/2024,09:32:22,FBRX,"Forte Biosciences, Inc. Common Stock",Nasdaq,LULD pause,2024-11-20,09:37:22
11/20/2024,09:31:36,RMSG,Real Messenger Corporation Ordinary Shares,Nasdaq,LULD pause,2024-11-20,09:36:36
11/20/2024,06:55:00,NAMSW,NewAmsterdam Pharma Company N.V. Warrant,Nasdaq,News pending,2024-11-20,07:35:00
11/20/2024,06:55:00,NAMS,NewAmsterdam Pharma Company N.V. Ordinary Shares,Nasdaq,News pending,2024-11-20,07:30:00
11/20/2024,00:24:10,RMSG,Real Messenger Corporation Ordinary Shares,Nasdaq,News pending,2024-11-20,05:11:16
11/20/2024,00:24:10,RMSGW,Real Messenger Corporation Warrants,Nasdaq,News pending,2024-11-20,05:13:00
11/19/2024,19:51:02,BTC,Grayscale Bitcoin Mini Trust ETF,NYSE Arca,Corporate Action,2024-11-20,09:00:00
11/19/2024,19:51:02,BTC,Grayscale Bitcoin Mini Trust ETF,NYSE Arca,Corporate Action,,
11/19/2024,19:51:02,ETH,Grayscale Ethereum Mini Trust ETF,NYSE Arca,Corporate Action,2024-11-20,09:00:00
11/19/2024,19:51:02,ETH,Grayscale Ethereum Mini Trust ETF,NYSE Arca,Corporate Action,,
11/19/2024,19:50:00,JFBRW,Jeffs' Brands Ltd Warrant,Nasdaq,News pending,2024-11-20,09:05:00
11/19/2024,19:50:00,JFBRW,Jeffs' Brands Ltd Warrant,Nasdaq,News pending,,
11/19/2024,19:50:00,JFBR,Jeffs' Brands Ltd Ordinary Shares,Nasdaq,News pending,2024-11-20,09:00:00
11/19/2024,19:50:00,JFBR,Jeffs' Brands Ltd Ordinary Shares,Nasdaq,News pending,,
11/19/2024,19:50:00,LUXHP,LuxUrban Hotels Inc. 13.00% Series A Cumulative Redeemable Preferred Stock,Nasdaq,News pending,2024-11-20,09:05:00
11/19/2024,19:50:00,LUXHP,LuxUrban Hotels Inc. 13.00% Series A Cumulative Redeemable Preferred Stock,Nasdaq,News pending,,
11/19/2024,19:50:00,EXAI,Exscientia Plc American Depositary Shares,Nasdaq,News pending,,
11/19/2024,19:50:00,LUXH,LuxUrban Hotels Inc. Common Stock,Nasdaq,News pending,2024-11-20,09:00:00
11/19/2024,19:50:00,LUXH,LuxUrban Hotels Inc. Common Stock,Nasdaq,News pending,,
11/19/2024,16:17:45,LEV WS,"The Lion Electric Company Redeemable Warrants, each whole warrant entitles the holder to purchase one Common Share at a price of $11.50 per share",NYSE,News Released,,
11/19/2024,14:32:49,ALGS,"Aligos Therapeutics, Inc. Common Stock",Nasdaq,LULD pause,2024-11-19,14:37:49
11/19/2024,14:22:21,ALGS,"Aligos Therapeutics, Inc. Common Stock",Nasdaq,LULD pause,2024-11-19,14:32:21
11/19/2024,14:11:45,ALGS,"Aligos Therapeutics, Inc. Common Stock",Nasdaq,LULD pause,2024-11-19,14:21:45
11/19/2024,13:59:23,ALGS,"Aligos Therapeutics, Inc. Common Stock",Nasdaq,LULD pause,2024-11-19,14:04:23
11/19/2024,13:52:10,ALGS,"Aligos Therapeutics, Inc. Common Stock",Nasdaq,LULD pause,2024-11-19,13:57:10
11/19/2024,13:35:37,INCY,Incyte Genomics Inc,Nasdaq,LULD pause,2024-11-19,13:40:37
11/19/2024,13:27:02,ROLR,"High Roller Technologies, Inc.",NYSE American,LULD pause,2024-11-19,13:32:02
11/19/2024,11:23:17,VRM,"Vroom, Inc. Common Stock",Nasdaq,LULD pause,2024-11-19,11:28:17
11/19/2024,11:19:40,ROLR,"High Roller Technologies, Inc.",NYSE American,LULD pause,2024-11-19,11:29:40
11/19/2024,11:17:39,VRM,"Vroom, Inc. Common Stock",Nasdaq,LULD pause,2024-11-19,11:22:39
11/19/2024,11:13:34,SLN,Silence Therapeutics Plc American Depository Share,Nasdaq,LULD pause,2024-11-19,11:24:19
11/19/2024,11:10:37,ROLR,"High Roller Technologies, Inc.",NYSE American,LULD pause,2024-11-19,11:15:37
11/19/2024,10:52:43,PRFX,PainReform Ltd. Ordinary Shares,Nasdaq,LULD pause,2024-11-19,10:57:43
11/19/2024,10:39:34,PRFX,PainReform Ltd. Ordinary Shares,Nasdaq,LULD pause,2024-11-19,10:44:34
11/19/2024,10:31:28,PRFX,PainReform Ltd. Ordinary Shares,Nasdaq,LULD pause,2024-11-19,10:36:28
11/19/2024,10:20:48,PRFX,PainReform Ltd. Ordinary Shares,Nasdaq,LULD pause,2024-11-19,10:25:48
11/19/2024,10:15:26,PRFX,PainReform Ltd. Ordinary Shares,Nasdaq,LULD pause,2024-11-19,10:20:26
11/19/2024,10:09:17,PRFX,PainReform Ltd. Ordinary Shares,Nasdaq,LULD pause,2024-11-19,10:14:17
11/19/2024,10:06:41,IBO,"Impact BioMedical, Inc.",NYSE American,LULD pause,2024-11-19,10:11:41
11/19/2024,10:01:37,WCT,Wellchange Holdings Company Limited Ordinary shares,Nasdaq,LULD pause,2024-11-19,10:06:37
11/19/2024,10:00:32,PRFX,PainReform Ltd. Ordinary Shares,Nasdaq,LULD pause,2024-11-19,10:05:32
11/19/2024,09:48:30,PRFX,PainReform Ltd. Ordinary Shares,Nasdaq,LULD pause,2024-11-19,09:53:30
11/19/2024,09:46:55,KRKR,36Kr Holdings Inc. American Depositary Shares,Nasdaq,LULD pause,2024-11-19,09:51:55
11/19/2024,09:42:09,PRFX,PainReform Ltd. Ordinary Shares,Nasdaq,LULD pause,2024-11-19,09:47:09
11/19/2024,09:36:29,BATL,Battalion Oil Corporation,NYSE American,LULD pause,2024-11-19,09:41:29
11/19/2024,09:36:05,GDS,GDS Holdings Limited ADS,Nasdaq,LULD pause,2024-11-19,09:41:05
11/19/2024,09:34:57,PLAG,Planet Green Holdings Corp.,NYSE American,LULD pause,2024-11-19,09:44:57
11/19/2024,09:34:17,NA,Nano Labs Ltd Class A Ordinary Shares,Nasdaq,LULD pause,2024-11-19,09:39:17
11/19/2024,09:30:16,IBO,"Impact BioMedical, Inc.",NYSE American,LULD pause,2024-11-19,09:35:16
11/18/2024,19:50:31,SOS,"SOS Limited American Depositary Shares, each representing ten (10) Class A Ordinary Shares",NYSE,Corporate Action,2024-11-19,09:40:41
11/18/2024,19:50:31,SOS,"SOS Limited American Depositary Shares, each representing ten (10) Class A Ordinary Shares",NYSE,Corporate Action,,
11/18/2024,19:50:00,WHLRP,"Wheeler Real Estate Investment Trust, Inc. Preferred Stock",Nasdaq,News pending,2024-11-19,09:05:00
11/18/2024,19:50:00,WHLRP,"Wheeler Real Estate Investment Trust, Inc. Preferred Stock",Nasdaq,News pending,,
11/18/2024,19:50:00,WHLRL,"Wheeler Real Estate Investment Trust, Inc. 7.00% Senior Subordinated Convertible Notes Due 2031",Nasdaq,News pending,2024-11-19,09:05:00
11/18/2024,19:50:00,WHLRL,"Wheeler Real Estate Investment Trust, Inc. 7.00% Senior Subordinated Convertible Notes Due 2031",Nasdaq,News pending,,
11/18/2024,19:50:00,WHLRD,"Wheeler Real Estate Investment Trust, Inc. Series D Cumulative Preferred Stock",Nasdaq,News pending,2024-11-19,09:05:00
11/18/2024,19:50:00,WHLRD,"Wheeler Real Estate Investment Trust, Inc. Series D Cumulative Preferred Stock",Nasdaq,News pending,,
11/18/2024,19:50:00,RCM,R1 RCM Inc. Common Stock,Nasdaq,News pending,,
11/18/2024,19:50:00,LGMK,"LogicMark, Inc. Common Stock (NV)",Nasdaq,News pending,2024-11-19,09:00:00
11/18/2024,19:50:00,LGMK,"LogicMark, Inc. Common Stock (NV)",Nasdaq,News pending,,
11/18/2024,19:50:00,POLA,"Polar Power, Inc. Common Stock",Nasdaq,News pending,2024-11-19,09:00:00
11/18/2024,19:50:00,POLA,"Polar Power, Inc. Common Stock",Nasdaq,News pending,,
11/18/2024,19:50:00,WHLR,"Wheeler Real Estate Investment Trust, Inc",Nasdaq,News pending,2024-11-19,09:00:00
11/18/2024,19:50:00,WHLR,"Wheeler Real Estate Investment Trust, Inc",Nasdaq,News pending,,
11/18/2024,18:41:55,PLL,Piedmont Lithium Inc. Common Stock,Nasdaq,News pending,2024-11-20,07:05:00
11/18/2024,18:41:55,PLL,Piedmont Lithium Inc. Common Stock,Nasdaq,News pending,,
11/18/2024,16:18:11,SAVE,"Spirit Airlines, Inc.",NYSE,News Released,,
11/18/2024,15:50:41,MI,NFT Limited,NYSE American,LULD pause,2024-11-18,16:00:00
11/18/2024,15:48:27,BKKT,"Bakkt Holdings, Inc.",NYSE,LULD pause,2024-11-18,16:00:12
11/18/2024,15:43:33,MI,NFT Limited,NYSE American,LULD pause,2024-11-18,15:48:33
11/18/2024,15:42:32,BKKT,"Bakkt Holdings, Inc.",NYSE,LULD pause,2024-11-18,15:47:48
11/18/2024,15:36:57,BKKT,"Bakkt Holdings, Inc.",NYSE,LULD pause,2024-11-18,15:42:00
11/18/2024,15:29:54,BKKT,"Bakkt Holdings, Inc.",NYSE,LULD pause,2024-11-18,15:34:59
11/18/2024,15:24:27,BKKT,"Bakkt Holdings, Inc.",NYSE,LULD pause,2024-11-18,15:29:30
11/18/2024,15:18:23,BKKT,"Bakkt Holdings, Inc.",NYSE,LULD pause,2024-11-18,15:24:05
11/18/2024,14:20:59,PLAG,Planet Green Holdings Corp.,NYSE American,LULD pause,2024-11-18,14:30:59
11/18/2024,14:15:32,PLAG,Planet Green Holdings Corp.,NYSE American,LULD pause,2024-11-18,14:20:32
11/18/2024,14:10:10,DMN,Damon Inc. Common Stock,Nasdaq,LULD pause,2024-11-18,14:15:10
11/18/2024,14:05:01,PLAG,Planet Green Holdings Corp.,NYSE American,LULD pause,2024-11-18,14:10:01
11/18/2024,13:46:49,DMN,Damon Inc. Common Stock,Nasdaq,LULD pause,2024-11-18,13:51:49
11/18/2024,13:35:35,DMN,Damon Inc. Common Stock,Nasdaq,LULD pause,2024-11-18,13:40:35
11/18/2024,13:26:47,SONN,"Sonnet BioTherapeutics Holdings, Inc. Common Stock",Nasdaq,LULD pause,2024-11-18,13:36:47
11/18/2024,13:24:22,DMN,Damon Inc. Common Stock,Nasdaq,LULD pause,2024-11-18,13:29:22
11/18/2024,13:08:58,DMN,Damon Inc. Common Stock,Nasdaq,LULD pause,2024-11-18,13:13:58
11/18/2024,13:02:41,QMMM,QMMM Holdings Limited Ordinary Shares,Nasdaq,LULD pause,2024-11-18,13:07:41
11/18/2024,12:54:14,DMN,Damon Inc. Common Stock,Nasdaq,LULD pause,2024-11-18,13:04:14
11/18/2024,12:53:18,HCWB,HCW Biologics Inc. Common Stock,Nasdaq,LULD pause,2024-11-18,12:58:18
11/18/2024,12:46:37,HCWB,HCW Biologics Inc. Common Stock,Nasdaq,LULD pause,2024-11-18,12:51:37
11/18/2024,12:39:50,HCWB,HCW Biologics Inc. Common Stock,Nasdaq,LULD pause,2024-11-18,12:44:50
11/18/2024,12:38:35,QMMM,QMMM Holdings Limited Ordinary Shares,Nasdaq,LULD pause,2024-11-18,12:43:35
11/18/2024,12:36:23,PBR,PETROLEO BRASILEIRO S.A.-PETROBRAS ADS (REP 1 COMMON SHARE),NYSE,News pending,2024-11-18,13:10:25
11/18/2024,12:36:23,PBR A,Petroleo Brasileiro S.A.-Petrobras,NYSE,News pending,2024-11-18,13:10:38
11/18/2024,12:34:01,HCWB,HCW Biologics Inc. Common Stock,Nasdaq,LULD pause,2024-11-18,12:39:01
11/18/2024,12:28:17,QMMM,QMMM Holdings Limited Ordinary Shares,Nasdaq,LULD pause,2024-11-18,12:38:17
11/18/2024,12:20:57,QMMM,QMMM Holdings Limited Ordinary Shares,Nasdaq,LULD pause,2024-11-18,12:25:57
11/18/2024,12:20:28,HCWB,HCW Biologics Inc. Common Stock,Nasdaq,LULD pause,2024-11-18,12:25:28
11/18/2024,12:18:49,LEV WS,"The Lion Electric Company Redeemable Warrants, each whole warrant entitles the holder to purchase one Common Share at a price of $11.50 per share",NYSE,News pending,See Subsequent Halt,See Subsequent Halt
11/18/2024,12:18:49,LEV WS,"The Lion Electric Company Redeemable Warrants, each whole warrant entitles the holder to purchase one Common Share at a price of $11.50 per share",NYSE,News pending,,
11/18/2024,12:14:28,HCWB,HCW Biologics Inc. Common Stock,Nasdaq,LULD pause,2024-11-18,12:19:28
11/18/2024,12:14:15,QMMM,QMMM Holdings Limited Ordinary Shares,Nasdaq,LULD pause,2024-11-18,12:19:15
11/18/2024,12:09:07,HCWB,HCW Biologics Inc. Common Stock,Nasdaq,LULD pause,2024-11-18,12:14:07
11/18/2024,12:06:38,QMMM,QMMM Holdings Limited Ordinary Shares,Nasdaq,LULD pause,2024-11-18,12:11:38
11/18/2024,12:03:46,HCWB,HCW Biologics Inc. Common Stock,Nasdaq,LULD pause,2024-11-18,12:08:46
11/18/2024,12:00:42,QMMM,QMMM Holdings Limited Ordinary Shares,Nasdaq,LULD pause,2024-11-18,12:05:42
11/18/2024,11:58:05,HCWB,HCW Biologics Inc. Common Stock,Nasdaq,LULD pause,2024-11-18,12:03:05
11/18/2024,11:50:16,HCWB,HCW Biologics Inc. Common Stock,Nasdaq,LULD pause,2024-11-18,11:55:16
11/18/2024,11:44:54,HCWB,HCW Biologics Inc. Common Stock,Nasdaq,LULD pause,2024-11-18,11:49:54
11/18/2024,11:40:12,QMMM,QMMM Holdings Limited Ordinary Shares,Nasdaq,LULD pause,2024-11-18,12:00:21
11/18/2024,11:34:17,HCWB,HCW Biologics Inc. Common Stock,Nasdaq,LULD pause,2024-11-18,11:39:17
11/18/2024,11:32:23,QMMM,QMMM Holdings Limited Ordinary Shares,Nasdaq,LULD pause,2024-11-18,11:37:23
11/18/2024,11:30:56,PLAG,Planet Green Holdings Corp.,NYSE American,LULD pause,2024-11-18,11:40:56
11/18/2024,11:20:35,PLAG,Planet Green Holdings Corp.,NYSE American,LULD pause,2024-11-18,11:30:35
11/18/2024,11:18:31,HCWB,HCW Biologics Inc. Common Stock,Nasdaq,LULD pause,2024-11-18,11:23:31
11/18/2024,11:13:04,HCWB,HCW Biologics Inc. Common Stock,Nasdaq,LULD pause,2024-11-18,11:18:04
11/18/2024,10:31:48,HCWB,HCW Biologics Inc. Common Stock,Nasdaq,LULD pause,2024-11-18,10:36:48
11/18/2024,10:22:57,HCWB,HCW Biologics Inc. Common Stock,Nasdaq,LULD pause,2024-11-18,10:27:57
11/18/2024,10:12:55,FGL,Founder Group Limited Ordinary Shares,Nasdaq,LULD pause,2024-11-18,10:17:55
11/18/2024,09:53:05,ISPC,iSpecimen Inc. Common Stock,Nasdaq,LULD pause,2024-11-18,10:03:05
11/18/2024,09:52:25,HCWB,HCW Biologics Inc. Common Stock,Nasdaq,LULD pause,2024-11-18,09:57:25
11/18/2024,09:50:20,YIBO,Planet Image International Limited Class A Ordinary Shares,Nasdaq,LULD pause,2024-11-18,09:55:20
11/18/2024,09:47:26,KSCP,"Knightscope, Inc. Class A Common Stock",Nasdaq,LULD pause,2024-11-18,09:52:26
11/18/2024,09:41:33,VINO,"Gaucho Group Holdings, Inc. Common Stock",Nasdaq,LULD pause,2024-11-18,09:46:33
11/18/2024,09:40:45,BJDX,"Bluejay Diagnostics, Inc. Common Stock",Nasdaq,LULD pause,2024-11-18,09:45:45
11/18/2024,09:37:19,TZUP,Thumzup Media Corporation Common Stock,Nasdaq,LULD pause,2024-11-18,09:42:19
11/18/2024,09:35:59,PLAG,Planet Green Holdings Corp.,NYSE American,LULD pause,2024-11-18,09:40:59
11/18/2024,09:35:13,FATE,"Fate Therapeutics, Inc.",Nasdaq,LULD pause,2024-11-18,09:40:13
11/18/2024,09:33:11,PTLE,PTL LTD Ordinary Shares,Nasdaq,LULD pause,2024-11-18,09:38:11
11/18/2024,09:32:42,QMMM,QMMM Holdings Limited Ordinary Shares,Nasdaq,LULD pause,2024-11-18,09:37:42
11/18/2024,09:30:44,PLAG,Planet Green Holdings Corp.,NYSE American,LULD pause,2024-11-18,09:35:44
11/18/2024,09:30:31,SGN,"Signing Day Sports, Inc.",NYSE American,LULD pause,2024-11-18,09:35:31
11/18/2024,09:30:17,SWVL,Swvl Holdings Corp Class A Common Shares,Nasdaq,LULD pause,2024-11-18,09:40:17
11/18/2024,04:30:53,SAVE,"Spirit Airlines, Inc.",NYSE,Regulatory Concern,See Subsequent Halt,See Subsequent Halt
11/15/2024,19:50:41,SGN,"Signing Day Sports, Inc.",NYSE American,Corporate Action,2024-11-18,09:00:00
11/15/2024,19:50:41,SGN,"Signing Day Sports, Inc.",NYSE American,Corporate Action,,
11/15/2024,19:50:00,LIFWZ,"MSP Recovery, Inc. Warrant",Nasdaq,News pending,2024-11-18,09:05:00
